{
  "actor": {
    "id": "H342ugmg0Ea-GvTpUDeqxqFKsgeirlcywX047EFubuU",
    "type": "agent"
  },
  "agent_id": "H342ugmg0Ea-GvTpUDeqxqFKsgeirlcywX047EFubuU",
  "data_labels": [],
  "extensions": {
    "sealedrun.anchor": {
      "anchored_hash": "2e5ad85304c65f0accfac67e02c56eba796476d6e538eec989142845ab7a7651",
      "anchored_seq": 5,
      "receipt": {
        "chain": [
          "-----BEGIN CERTIFICATE-----\nMIICEDCCAZagAwIBAgIUOhNULwyQYe68wUMvy4qOiyojiwwwCgYIKoZIzj0EAwMw\nOTEVMBMGA1UEChMMc2lnc3RvcmUuZGV2MSAwHgYDVQQDExdzaWdzdG9yZS10c2Et\nc2VsZnNpZ25lZDAeFw0yNTA0MDgwNjU5NDNaFw0zNTA0MDYwNjU5NDNaMC4xFTAT\nBgNVBAoTDHNpZ3N0b3JlLmRldjEVMBMGA1UEAxMMc2lnc3RvcmUtdHNhMHYwEAYH\nKoZIzj0CAQYFK4EEACIDYgAE4ra2Z8hKNig2T9kFjCAToGG30jky+WQv3BzL+mKv\nh1SKNR/UwuwsfNCg4sryoYAd8E6isovVA3M4aoNdm9QDi50Z8nTEyvqgfDPtTIwX\nItfiW/AFf1V7uwkbkAoj0xxco2owaDAOBgNVHQ8BAf8EBAMCB4AwHQYDVR0OBBYE\nFIn9eUOHz9BlRsMCRscsc1t9tOsDMB8GA1UdIwQYMBaAFJjsAe9/u1H/1JUeb4qI\nmFMHic6/MBYGA1UdJQEB/wQMMAoGCCsGAQUFBwMIMAoGCCqGSM49BAMDA2gAMGUC\nMDtpsV/6KaO0qyF/UMsX2aSUXKQFdoGTptQGc0ftq1csulHPGG6dsmyMNd3JB+G3\nEQIxAOajvBcjpJmKb4Nv+2Taoj8Uc5+b6ih6FXCCKraSqupe07zqswMcXJTe1cEx\nvHvvlw==\n-----END CERTIFICATE-----\n",
          "-----BEGIN CERTIFICATE-----\nMIIB9zCCAXygAwIBAgIUV7f0GLDOoEzIh8LXSW80OJiUp14wCgYIKoZIzj0EAwMw\nOTEVMBMGA1UEChMMc2lnc3RvcmUuZGV2MSAwHgYDVQQDExdzaWdzdG9yZS10c2Et\nc2VsZnNpZ25lZDAeFw0yNTA0MDgwNjU5NDNaFw0zNTA0MDYwNjU5NDNaMDkxFTAT\nBgNVBAoTDHNpZ3N0b3JlLmRldjEgMB4GA1UEAxMXc2lnc3RvcmUtdHNhLXNlbGZz\naWduZWQwdjAQBgcqhkjOPQIBBgUrgQQAIgNiAAQUQNtfRT/ou3YATa6wB/kKTe70\ncfJwyRIBovMnt8RcJph/COE82uyS6FmppLLL1VBPGcPfpQPYJNXzWwi8icwhKQ6W\n/Qe2h3oebBb2FHpwNJDqo+TMaC/tdfkv/ElJB72jRTBDMA4GA1UdDwEB/wQEAwIB\nBjASBgNVHRMBAf8ECDAGAQH/AgEAMB0GA1UdDgQWBBSY7AHvf7tR/9SVHm+KiJhT\nB4nOvzAKBggqhkjOPQQDAwNpADBmAjEAwGEGrfGZR1cen1R8/DTVMI943LssZmJR\ntDp/i7SfGHmGRP6gRbuj9vOK3b67Z0QQAjEAuT2H673LQEaHTcyQSZrkp4mX7Wwk\nmF+sVbkYY5mXN+RMH13KUEHHOqASaemYWK/E\n-----END CERTIFICATE-----\n"
        ],
        "digest": "2e5ad85304c65f0accfac67e02c56eba796476d6e538eec989142845ab7a7651",
        "gen_time": "2026-09-28T06:47:13.000Z",
        "imprint_alg": "sha256",
        "nonce": "14723731535173501295",
        "policy": "1.3.6.1.4.1.57264.2",
        "token": "MIIE4gYJKoZIhvcNAQcCoIIE0zCCBM8CAQMxDTALBglghkgBZQMEAgEwgcIGCyqGSIb3DQEJEAEEoIGyBIGvMIGsAgEBBgkrBgEEAYO/MAIwMTANBglghkgBZQMEAgEFAAQgwNLFRGgKmlAJtacNMtegHlKfnp3PB3yfc3/zfaphk/gCFDRceo0ExDRSsoB8rsuqr59y1PQDGA8yMDI2MDkyODA2NDcxM1owAwIBAQIJAMxVM9JSO8FvoDKkMDAuMRUwEwYDVQQKEwxzaWdzdG9yZS5kZXYxFTATBgNVBAMTDHNpZ3N0b3JlLXRzYaCCAhQwggIQMIIBlqADAgECAhQ6E1QvDJBh7rzBQy/Lio6LKiOLDDAKBggqhkjOPQQDAzA5MRUwEwYDVQQKEwxzaWdzdG9yZS5kZXYxIDAeBgNVBAMTF3NpZ3N0b3JlLXRzYS1zZWxmc2lnbmVkMB4XDTI1MDQwODA2NTk0M1oXDTM1MDQwNjA2NTk0M1owLjEVMBMGA1UEChMMc2lnc3RvcmUuZGV2MRUwEwYDVQQDEwxzaWdzdG9yZS10c2EwdjAQBgcqhkjOPQIBBgUrgQQAIgNiAATitrZnyEo2KDZP2QWMIBOgYbfSOTL5ZC/cHMv6Yq+HVIo1H9TC7Cx80KDiyvKhgB3wTqKyi9UDczhqg12b1AOLnRnydMTK+qB8M+1MjBci1+Jb8AV/VXu7CRuQCiPTHFyjajBoMA4GA1UdDwEB/wQEAwIHgDAdBgNVHQ4EFgQUif15Q4fP0GVGwwJGxyxzW3206wMwHwYDVR0jBBgwFoAUmOwB73+7Uf/UlR5vioiYUweJzr8wFgYDVR0lAQH/BAwwCgYIKwYBBQUHAwgwCgYIKoZIzj0EAwMDaAAwZQIwO2mxX/opo7SrIX9QyxfZpJRcpAV2gZOm1AZzR+2rVyy6Uc8Ybp2ybIw13ckH4bcRAjEA5qO8FyOkmYpvg2/7ZNqiPxRzn5vqKHoVcIIqtpKq6l7TvOqzAxxclN7VwTG8e++XMYIB3DCCAdgCAQEwUTA5MRUwEwYDVQQKEwxzaWdzdG9yZS5kZXYxIDAeBgNVBAMTF3NpZ3N0b3JlLXRzYS1zZWxmc2lnbmVkAhQ6E1QvDJBh7rzBQy/Lio6LKiOLDDALBglghkgBZQMEAgGggfwwGgYJKoZIhvcNAQkDMQ0GCyqGSIb3DQEJEAEEMBwGCSqGSIb3DQEJBTEPFw0yNjA5MjgwNjQ3MTNaMC8GCSqGSIb3DQEJBDEiBCCuzGF8+nPdZXRwqsiYWPJVMb9jnyAPhfY6Jy/nXXjE8jCBjgYLKoZIhvcNAQkQAi8xfzB9MHsweQQghfknvAerYsrDtENWwQ78gbLGiD/aernm2HDZ0TrNBbcwVTA9pDswOTEVMBMGA1UEChMMc2lnc3RvcmUuZGV2MSAwHgYDVQQDExdzaWdzdG9yZS10c2Etc2VsZnNpZ25lZAIUOhNULwyQYe68wUMvy4qOiyojiwwwCgYIKoZIzj0EAwIEaDBmAjEAofb3ygSDjERX0j4bxK8ThuTniE6NeDYrGj1vqo/2hWRJdUPPw4N92sX/J5UwjlE2AjEAyEa5BFx9qOSGO+da27pbPMS/T1W7Vlodh8mGg67FsKEv0erEIMCuRsi3R69luzjw"
      },
      "type": "rfc3161",
      "witness": "https://timestamp.sigstore.dev/api/v1/timestamp"
    }
  },
  "hash": "f9b9ae6c69fee414178f52b41809f45c835ff3d276a49a1be61c22e8f23ee8a5",
  "hash_alg": "sha-256",
  "kind": "anchor",
  "occurred_at": "2026-09-16T12:00:07.000Z",
  "outcome": "success",
  "prev_hash": "2e5ad85304c65f0accfac67e02c56eba796476d6e538eec989142845ab7a7651",
  "principal_id": "qJtRVbgIsIjNNo6VuDr6nQ50Wj3rwEAAuR2e385pby8",
  "record_id": "0192b3c4-5d6e-7f80-9a1b-000000000007",
  "run_id": "0192b3c4-5d6e-7f80-9a1b-0000000000a0",
  "seq": 6,
  "signatures": {
    "ed25519": "EmSbvELr7kxosYQXMttoNIeQoLzYuJk23x86fMotz_8QG4tsMZNO6YyOHjLdgOhP6G6tPXn2isyG2K9bpnCpAw",
    "ml-dsa-65": "KC6u4fArPPEmEf-fZUlJUUh5RrIHbUvwDC7yAMmHewDWeeYyIWlio56ThaOtNijG7GAJigYA2wkT1Y5tgl9g_u-TsaCQo1_WV_NZagB-KZjAqT1p6-bQyEkxe3giBIbQxQx9-8pOajXUImHvUhOmjpzuCN-wleztTbmNsYmNrZXplyDUGARDB9k2fToq9A67SyNVrlyxsLyA_7-yOduAuUdXpKiiLUKTPDG3HqhyvaLzQJMHgRRlRq6Yfn9UIwJgrJ7BfudWoKT-v0C8zuvuC5pvgoPVCx7WqGhY43CBdLZYEIUqkFFmuMsvBvupuvVA4LtOW6W0pJ4D3AqcSCGG0k6E5lSi22jw4oo-orEumRsRGy1OJnJPYiVIuieHctkhcnKKKaOkxHwv9l2jeST1K-oy9Xcpxob-ITD4_3_-2ErTuMF7XdliFkHdz87BZgaZMqxq5WBlMxx0F3UDEiWY8tLnK4RvuPkaEfxqvJVDU7ZG24qlqiE29cqZvMar-OBAf9MKAVAsLjyHz4I9vExPmZW0gPhvLSPyszKKg4-zBja_NSyWxzr5rNQh4erpElmJkhQNeRs-R2lsQfM8kVT2hugOSufpZ9AHFH1hXHd7G3wqaFA4_kLzvapZq3bScn9ZytPe06CDDRknexJl0VNVpusEF5kb_Jz2zNdtl1qATrwO2QtRBIhEyIQRC3NQR7xZfT1ah_WOeOpTWzqdWbjFKkS_njZd-EfbLx0Y4mNnH9_n8oBYdpjDgQCgbdbcUA-QWrev8CrUxBm-r9juAs-8x7izotRsDrCfn1_Jd4iyaeXxnQGWq-x0y5-cTQ22x_SHfKOn2Vm6ic8-jg8RM-yVWmEmSLbu773HM8px2L2pMas8zSf4Q-Y_-o9YW2kdZCVPfOeat9ajnr2pe86KoiswUKc-IyTXKRaMOJCvu0-pMZQpwnn8EslQXIsaACRxB_x53tlBLG7MmNOIa7KE6UlPARgNap7Fc6vsXk1OwBSLVSPXVmpxdGAJ8KFKTsmrvUge-RM6P1848ga9XLt4WVLAm6Q723viGeUzFIjW_MmSTo_y7-YtfvVglUBu6O2RsJn6duDt_cDgAcXI1HmBtPPP86-dLl4pqvWRuFuixZt8_JvadZ7sxznLqMkwdtrn2Gfj5QMPdeczLo0cw6sI3hMNfHNDUtJmelGjyw90dBR_PJYn3Jgd6lv0R05GbQdQSqpADTJYzVNNcrkbpYG7ujZl8pvCMLlUZk_Scbm9yKnf8vDEtPGpbyP9nbtsvvEosn-aREQKdiL6p2g-UqETV-5sJNfIkP2DHk-xMbCAU7DngHWRI7VFUZDBVsSdqrV7bGCqgZi6bp6CvEIPdObTin12N_BjeuQ5KuGMh6BfqcORgpxP9vvCrIXrk2SyKWiFHpyaU1ZatrSqelMkRZu-b5o_9GbMHNIeLS6vE6fe0V0zoayG9rSvatP0vM7uXu4rfRHHi0bKLvUK4BbKvqTk9pw1CP9BvST4HOuwomEjer7WqO9c422fw4GrfldqW7dciaZsazheL9acrmysXhW3VbMK77ot_mi-ucGwYPrB2WmeOwWiZ8NMaOP6s6jvPSwvHQ4JBJkH7rPJmlGRi81UUT4gxCqORKllVV5-Y5geES4Dh6E9lda10J5qvkteu4GVCB9DoNcY6hFRqrfJprqi2SmZKADk5vaAPjGZ3W2V9TAiRUB3GOBdqOtmvYGjghq-XAPROCkwaMaQWkCvzNNz4uRiDDqXURY338iCjDjOt7oqck9TmRvB_m7t3rXakiZV_dBvbWEjSv2EZTZqvu0Us0R2o5GWt_PZePnFnU1uTbceyRp3wrjHJXOoIYtEp_MOmwZNUrbYOMbT9ULnnkx1UPv_AJNgppz2Yw-fb3N4d6krb9Hxmn2EKziY0sJNdpEMvgFJW1_4oQpxNRNyGOzksXeWaflPsGe6OgC9jLHoVZY4AS6cVYmlbbJy76hv69j974_nnhibhJ3yDERtvBTVLJX_CT4lHrQTz2rmkM_5kwlw5CcfK6YM3RsBz9Yb0r2lnruuHtNuHr_8-N6Nq4znDva2BHnARAlOhyFUmnTvPsPSmXvmCtRHR-VFUHuOhVuTUzTYOKhV2IzIgEQrJ1x1mO7vbB4dknfU_6GGJmax-BzJ-G2QGuRjuzpBX7aSznFnpy14F5xOfDza62MEIVVzOka8MTyyuHKrITEsyaHGWuICwHavFdllQWRCfUbjeiqYG6LJbjJqQy_P1JLXtyG_2jTRdSJD5dWqE8CK-ngVpsyNs5kWhoua-a378MynJqJzdhC2EWCJtXDL9AtCqbPrKp_9ZijNWAcWqXKWgtvBCDSniLsmPoN3LG9gm6hsf5P0VNTqfJ6N3g3cskPV6GkDoxchQ216g97k0uR4lnKKi9VkVya2dw5e_M6AXt63NdcGuq7uy5E6pLmv4MTgtLDmnAn3UlJK33RgWNJU4e_9HjJBJNkdjm136U_M6cbtP50nKy25RLAMe5KzeGIo7JRkFoRG60s3Ujtk9Ph37wilHTtDOCZ8UtsaE95CN3ibl6xwzUU7ptz-etTZylbgrRQUX6lJ6yTmVTGPl3GskZ16_BVXKoufZnIuK7A5pvEhrkL4SHnY56CRdN0nZdOQLMz9FWNhSgKlNrE44H4j5QEgy7FOBq5sdvgXnR2ATqmZ9vlBkPjc2iuoZzOIXJ3Jvz9TaDlRm3BmF9X8duk7zKoIPg3qQ0jUxuYxaWTjDIiOnJafKAiLTgy3tPD4ygFvs8UnpDR4EoqlxxjDgcTx_KlPnvOiYQTVgmtXBESb4oIxi20LoD5tsqIJPqAZQBopUzSs6g4lo9E0QNtGdKRpqK5OUnyfeeEi8_ZNSGMCRxfllQayCQXJtd1li4si5_W_J0EGoqNaiSSC-JPO-SQ8GZV40NI-5FG385iKPaUmbGo7Pp9t_hQONzFX_qhB6uQ-qtdyrLI9Q22b7-pz4sfbCCto48EwsAjg-zA3iVtLGSoHMR4P6lDdLKsBUwP-UHrrjxyD21FkOmbbdDnnehE4ONlO3c69FRe92CykXThGzcA-DSifDI3MkMtXK790lQic4MplDkruyNw67twq9-Hj92txcBVfDfnhJTXOWPCCtalfEIGkKTi9kMfOVVkBkgDBlpICG9rQAlqpt4N3fzYQibJfbBBNL_FaRzlC2Qmw66cGASQqw7TkTOwCWMkrtSkAEao7BsiXao2ZKiSFJfh7Q9M456eGLB_lCxeOeUQMuXWM_7dPIG_C1ZZMkedR5hMWokoKhO2iyKQt-sYOUikzGd1vWIr-1AwD3lTXeMOxPIQMB4iC_Go-tt50knEg2682Mfcl5O73y_OCHp7CDh-HlS12D9p47QE5-6Fo9qSjXUBgSi3ZMGlq5jzBInFnAwklKudDlVFyqojjJVu28nUcQJ5aJ6cs4n8H92m_mqN5zhnzeVHP8cGgqingfd_cBaWXAv1IbgkcD5uofCUybyhMsnuHhblqk3Ea6zF9WAafcSBgcYIFfXDaTWPe2TBOCSLyDTGRE9L_heo2X5MrSuGYJUBOWeRzdzN7pjTjmDCS69hpS5ndDC5bch4cfAUVH8boGcfqUNcsOtmeEovA678NfFDFP4eR8G7vpqNv8kyvnVliET79AZK4wA6siEPlQe38SQBKc9J91XIf8TG00oBr7zQLDDhM7SOYUiMEtM4gzxygQKqcEmv45dTkNr29vBM2xn9qGYSWoMcupAA1ncNzNyHJlinlLpkUaxjVH3No9QJipRt2pvcdgjgsDaTfb7bqRtqNgr4KwZBPCPO4qMSz6deIBswH78y6XJ03hWGC2NlOyRNKruxKkwj-BZ-seAgBLSPjxvfZIX5JapPvq4u-j1B-5BpnlfHFZMcU3CzbWfWuH7WTdNFO-uAIADlhzMMsycBbBSDhglXqWi_lYSiSRj6666gNBUACSNfQX0ZNkNNv0X6Hul6pueX58Su2v8gSQUJtSbydl4SLcnfZMKlsm0-bcV23J-2_P2b1nrvkWW4lODE-f2ZoPr-PmuJNg4kjMTGDWw0fAhJ5eFGqBAZb3dIfFMJ_h2Q66e9wZRmVHHvNsrT_sX66IB3cEDLZpuQG2TTMXfI6xO5X-I89pc4QxkkKBYN3EbRzTedU8j001vvKHk0fpKydhhlURopDxkqdLBV5eFmZu6-b7igu2QQ39l7Z8xSpADiORDMQkkDIFvwEwK-b7vpdYz_KJ6vwT46qn1teq3n3owlpal_AxAPHgfEy6XmY0u5wZoClbYWBy7DPCwDIK0ZjqnJb87IfvaZ-uFMcf-CTstkDbwRP2-MwjpXuiSdmHS184iI6QF9ymqLMAwwlMltrdX7P4gw_lbX8HytAbYyotrvJE1VZbrsAAAAAAAAAAAAAAAAAAAAAAgoUGSIn"
  },
  "spec_version": "0.1",
  "target": {
    "endpoint": "https://timestamp.sigstore.dev/api/v1/timestamp",
    "name": "sigstore-tsa",
    "type": "witness"
  }
}
