{
  "actor": {
    "id": "H342ugmg0Ea-GvTpUDeqxqFKsgeirlcywX047EFubuU",
    "type": "agent"
  },
  "agent_id": "H342ugmg0Ea-GvTpUDeqxqFKsgeirlcywX047EFubuU",
  "data_labels": [],
  "extensions": {
    "sealedrun.tombstone": {
      "fields": ["request"],
      "legal_basis": "GDPR Art. 17",
      "reason": "retention-90d",
      "record_id": "0192b3c4-5d6e-7f80-9a1b-000000000002"
    }
  },
  "hash": "8412339398f0628a037fe254a3ec28152a1fe448a4e0a3d4fd85da82e8cb6a6c",
  "hash_alg": "sha-256",
  "kind": "tombstone",
  "occurred_at": "2026-09-16T12:00:08.000Z",
  "outcome": "success",
  "prev_hash": "f9b9ae6c69fee414178f52b41809f45c835ff3d276a49a1be61c22e8f23ee8a5",
  "principal_id": "qJtRVbgIsIjNNo6VuDr6nQ50Wj3rwEAAuR2e385pby8",
  "record_id": "0192b3c4-5d6e-7f80-9a1b-000000000008",
  "run_id": "0192b3c4-5d6e-7f80-9a1b-0000000000a0",
  "seq": 7,
  "signatures": {
    "ed25519": "Sy5Ljdxt38pQSJijrk-xMl0UOTMgyVROGtPCxDh7JECRudVbqqYAzkxU8c4H4zbzAYoZdeRPmKqE96v2PxM0AA",
    "ml-dsa-65": "rBYXwIFiXURkipGux7csC6iDxSz-JhkqTOGDfvxr09Mr8cNA7CrbUqVBXaGdXI3DDGWyrDrLIVWdiVs69M7N_LHXaR3QaYH4tPstSM6NV2JjSjJ3xh1EknUL6t_wwgPFJVczIQ8nTmfSrLC7qhC2dDlV5HVOBm3eGbvifovUoQzebJ6nIn5ZCv-gISjfX-B7XNvo8LeZTo_YxENqLDU8JCFvgBgA9w3fA4BfJgQg89Qd6VByuieC4--HalrP_NDX2X2Wj76l-wILf_K0B7qcWKx9pKAR8J0Iace6BCq5iaD7BYI8SD6LGDuHMu6EHFJyNRA0GA4AvaeQfcom561Ks4EOVVmJnUnLUghcsp69lVH18NQzE4CGMHFmQTAuLTy3POjohjn6ieeJPfYvaRq2TAeEufKgij6283_X6JiMVc8Y6CdZSLDhgyKUabv0stmyMBk_4woaZvak_CVAGJzg4sdeFCqJPi-IeSHtho9CcPrJvHHTS2UJx-FKuCDZClHl31FMZYKDOxSUvJHl9Rrt2BYSFPAEa1gkXtASCQOSnuKqSDyw9Hl-16qls7ZdAwfL2BjEKr-YYvCgVVvz9ZQPAPlUK_W8ifZv7Dlq3Nq2ArgrXxe_5WD4j8RqBy59Ho6Ve01jNe503F3K7XRDW_396u1hQInBKN-zBhfpmT4apwIX15uSrIlV77EAsgAADvqNpr_xOX6G9g6Ax-HJQK3DJWv6nWjzl6VtHyCJ6s2oRzemxwABRvjoYL6vXTHH2xNRl6NEwRq2le2Q7DV6JdcNSHd9oc6RxfCGkVOJRE95s4Ey9oTdFXTQ6tSwjaa3RteodZuflcTEmX1Z6r49fjQWNUtctEpF_cy9Q-V6zT_Hwt8Gz6oEvU4QHL6Is1ujFrCTlE4Y1pnc9BxdJS3jyrXuUgZ_jmixbZcXavtjyuAtt3m-xMyeJIoOX_kYehIA9IY4amrVLbKLNY4QynQUY91SFWvLCxvqiCPb8U3pfe0c5xtQgmVO6-niJ8Ox-DjI1K_ANprt0oQmnOj_0MR0-yYCmrXlHnto98ttMi_nfnuNBas9UDzBLqQaMW-k8U1ciA7ASzJJOBE7_LW1-mmDjdEhmmozmBNR2X3iPZn0HWUwtTfMf3Kul_-4Vu2kxjqZKGHehuIJX08STv5P-RpbHtoZ4gVJGy6zwjGsrFU4jEhine8cmAoB1oLSAFJTrNSdc0u1_zxP8M8dQdnTM7Y4HjcW1QB_RoZi6e5nkGcd7fLWL_t-2AXNsIaNOEIrony9vg5RrUwwB72xsB-DzRMMkNkl-7u1nYCog6z4sG4QqLz2N4DRTAbiOQjGXh4xirQkqy36Fym2Jd-kPwRjU3zfOIaW9bQk09bB7cIhYRAxEhQRYpgDghHXHNuKMv9LP8m_2X4hTW-WUC8wvYsogaGGTP2DhMufodnnLhqiyoln0s0fGrUHZOvEKrW_xadBAjm5rN3n3UKW0C5uFAgtu5y1P7yDqr_p5KRwJZ2cdtxuNbwmzdo41jEw2vmIZJ16lMaQtSUggTe69NUHat9Nr8J48B43aILvM3fa6kezZ7uETlfyax-UoaCNUOtdPJtx-a0N3AmeFtsf6ukSf3418FAGmamiLaK8Qa_AgaD5HpsjthppXbVQYKMbiZoR6Ni2zusgkrfwXK61kC_ElURa4xQTHJai5s9ozgBlpKSGU0eYcSny1XxGOEFan_vNMZeiV9HHO9LmSFSPCqi7fRN_EAjylaCSsb_LQZBr3_LmWrlItTIOo5YT6weiqiVimedEluaGQ2ZrfTsaX9W282JfwF0X6CdBa8d1kOFFCjnzNsicJi3v6ePryXO9fbhWEgMDtHLEG_ONvhzPgBwpVZuGpeLgK-SxHYxZxDNI4XYq_NoBG0TAP9baMKX4MbXgzYdrlRMxrVeOuhDDg8p3DEqGvJQ3VD62v6Nr0yXcSj8MFRp-_8GqjPVJVhOPQdbAugjKbJsyhfoqQtvz6ED_l14aY-SoLsHyBl31b_5Ysqud_l9H9ddMzgWt9Pa6dIBB3M9ObxUSHT-6DC25Zam0CBiP91JwzDqIZRliupv_j93dsPl4bITRjgbJTZcB1O91hneuy0NGb2uzyyiLrRVAi9XFhfh7Ayb5I7a_zM82a6dPK2Jscwtwl85QGGSxtDf6QEOVDxYeu6xNX7Sj9Vts6U75Mjqr3d3hzBL52l514vF1PR4a08ggcOXEpRGhxY-uWlsuZFC4kD0NLf16aIsAej0wE8VEh0qsD9eLNT3XDkkS3dqot52bO6hxYE3jPij-iu24K3YRAyu8e1c5aeexw5FVoTb-qWWejrZ5j8nrBmqRpJsngwDeu7YpavPKzcVk_B3CNhk7zwHq8P06_i00rh8eqI-ItoPAkVyqzxopphjtZvEanIn1Zjpy-AgICONCCko88D69HEG1MHFQVWnslajtjAymArVdEKVL4halWbrTDvGiKgmIWOeNI0fgzZxAmpPdXRTcud72yfGsfPHF6Go-YqOcE99r9a9jqkD2dgb_IDDjzoIl9JI0RQMQixMb7GHI0JWwossc_6J95r7Nb-dFVsD6FT2hpHdEcsK2dGrjJ2ATCEvdII8TjWTyTnAGSdMr1SnPi8Vaf8_BpRsKxa9axg4MTf2CMCv-Sp09RO6tOgI_Zt4vCrH4pK6l89MPumfamixRoQnlwptHY8G5Jm0bliYytVIw_yYjoEhMlNd-Fsb954WdzEC9XsLDrGDKL3mGbfi75sfiEBpN1IddGgvmlB0DQ01KE4dHUP1OPSFEb5JyWMktzE_0TrDqFFwLAwAcNKHOGxZ_j4ubGTU8sUtCrRbEouAVg4RLVWOwFDdcaoBUgvX1xUTZxE86VJ7q-Q8pauMe4zxPYuYESV2-0KV54dbC1ROWJL9MkywJUsCIULS9A0Zf4pzGY3cd94omCeZfGv-NuIyOiNarSIZYbkHpwOmgQ_EUwqHiLmy5S4Xsv63ZgrVJiFgTy0abGBBDr_VfnQkMYlSp1E-WBLs2v7cdCKd1ihLb_MOqzFY1kC3w1-Mv_5ZxcVlmaIZ1CRBAJcKEBFEOTsyUXDX8MpQtN-NLQMicz7_F2iaMFJhoi8vjKpI9QlISObJ1TOKWAxDJBYNJQuEZQgNedVZl5_sHS3Ilvbv78dfoGzIToyflBwGgyjmc3BOFekuNaqFLQNQNGmu7ye0r9g7loQBBiBAAYJw4YE_v1CsxCW5d_aHi1wfg7TeM6JkXWspRcj9yZRZA9IA0EKfaJ54OZPFSKZSL_e6KIzkTNrT-D1hT0lq4L1nIwSCq_DU3AK5VfGocDrNV9nv05-YtwE9mGNRBWJC1S3tNqbvEsJEE0c26Ng8_vXUSjLs1arbqsJCR3OzuMk7W8UCBLsHy6WUE-oCv1DWHGGKjZ4nkCQPIw9oFBRlhUJRBWmcSvT04--p73jOQv3KgHqGj0HaB_vL9GF4HwgcwqQxKhJ6HOi845sJp6QIx7kCvudkNHH8FDIlE4MuU-sumg6wEZPYktv6DVB5UA7184h_BanCqrwTs124HL0_zvRRps4lIUCqZtPTKu4DVkHbxzEl7tKy7OQPxtHW5zM6E5oRIQPB0cLhUlJgr0ciHC6Pb4HYOmOnuNDgI6_CWnM3rmVlnxkx6C1SqgtFiAnxFzt7LfXNvji-p1Dg7566JjKDMCLbhLEsFW5aekvrRiozFBUCVXVmGeh1zEVB2RHPRJweCePnanNg58sJ7nxp9D0B67EcUGM5u2utvmoZJ6eBrdjJYWf0ygQx_N7JsD6tW1nTZTX27_wMzROLkwAOdOAC4O8LW03cCsNaY7QiDkH6BT-NxBEqePcd7rERR9HXp_kYRUuj0V3FNwzx_FWleTWQit2PwHRBDoAkC53A-UHhO9ol99E8786xwF_r3sc7DK7d4_Yq_jFjPSPDMcq84etzcw12-8XT380h9yYdMENBHtG4FVprNW5Xwf3IapGFAxfLWC8hzjxDREOOblt8ArJt8RkuTBJx3qBSpM9LsmawdxlBllY3aXcQUAIHSVCEOd4V2qDv4bFoEUjAjBQPZ35mOl1VVG9OhCAUJ7noJbMDHGBhDUVjgKmCYzXHvPrcUHdnZ0mGVE09ydVsDsp6azB-TjNklxIC__5AEJhT0boChcGAFGhfRHCQBf2z-uS3gOpGpSzmCADXfqkBKEV86JLTowMJVrwwNmICtEoUIc7jMTTb4_UIAhgnOrM61pIOP4fCBUoMcTRlfvQ7vH2pGEypwP4CdPXbeYkRyIDVSuJbIglcUaRdJyMjV6FM_5hCL33WQ4LMQys8mb0VmP6nilSWk1hdn2W8q2RZ74QtGWHGvw9ERVF1laqTi-QIMDz5NV16Co9mJlzQ_iYrXAAAAAAAAAAAAAAAAAAAAAAAAAAAAAgkRGx0i"
  },
  "spec_version": "0.1",
  "target": {
    "name": "record:0192b3c4-5d6e-7f80-9a1b-000000000002",
    "type": "none"
  }
}
