{
  "actor": {
    "id": "H342ugmg0Ea-GvTpUDeqxqFKsgeirlcywX047EFubuU",
    "type": "agent"
  },
  "agent_id": "H342ugmg0Ea-GvTpUDeqxqFKsgeirlcywX047EFubuU",
  "data_labels": ["nda"],
  "hash": "2efb465244f0fcf660094be21dd77c78f342058be51ef8200a71c6615059c833",
  "hash_alg": "sha-256",
  "kind": "llm_call",
  "occurred_at": "2026-09-16T12:00:05.000Z",
  "outcome": "blocked",
  "payload": {
    "request_hash": "Jm6tzdPGE57XeprZfJhxH5wsgsTf-czFs0fwo4ywM6E",
    "request_size": 67,
    "storage": "none"
  },
  "policy": {
    "decision": "block",
    "reason": "labels [nda] may not leave the host and no local fallback configured",
    "rule_id": "eu-strict/no-nda-to-cloud"
  },
  "prev_hash": "e20363304048610a068535dd0f76302bdd17ff804d8bc746934d9f2253e6a472",
  "principal_id": "qJtRVbgIsIjNNo6VuDr6nQ50Wj3rwEAAuR2e385pby8",
  "record_id": "0192b3c4-5d6e-7f80-9a1b-000000000005",
  "run_id": "0192b3c4-5d6e-7f80-9a1b-0000000000a0",
  "seq": 4,
  "signatures": {
    "ed25519": "CVT4cd3t6pLfhb8HVWkL71mL8h3ipfck4Gv8KkTp1ePsavAFegV05cI4-8g4RyOd4jZrTl22A37wRtQB-HafAw",
    "ml-dsa-65": "cv-iFeS8OCbrYnfBW4vg9kws85J4SF7aPlDfHxNmBttgzWXMNLPsrB4PgMCZJvN_RgOlsjLFYaXcQL5z6YIQN5a7h82W-9S2T2LURqsq1KDtHJk7C0Ot4IhEiMazul50Uv7idBky3_vNU0dmbYVMmZTBoyi6w0v7CvAdi-F8XRuIx_cbK0fP_A3wc7uw173j-kN032k0px9C-7DTpRCcdxifNK4_OHyq6wVek72sQFpTTbLZQzStMpnUNcthVJgDPBHeEYKXKAHuYV-M6xGHC5rWxwnBJjlwds4L6LQ3EJjuRheF378NWNbXct5HqyGUidSHFBTVLVZ-qfdLLB5RvJSzUpB7XFK-iGJy8oXT8YX6UogtIn68XV9x9gMDow3Slj09IXD6lPf5fuBSbCMgDbBql312N9P6OOsk7ae5tSw53EjmeBFDR2h8lJIvakQflDYl-7Xzdbvs1IhOhUHguq9zbD0QqM_SDSvNw5-j9GW68RklYNkc6oB8grzYeNxCh_OBOSbhxr7eJCY5VxiUa4PA9p7CMFizyXAydr8nX13Aitu53EYzeF2MPGm9gw8R5MUuPOoKUzXUywU4o9LI_8GIucXFbrb9yP-j1TJO1mF27xon_Bcrv8sq-KrXav_53JFR8agEi4QXGNelIjEV1QmpkT9zgavKO1Q2pKrB4J8BuoAegU2NpdCd40rqiTUg_QNQuV3OBQO9eyYVSrtso18AzfTCGdAVxflabs_g1Wq-CRfftIxSRddGLFYpbp6QslCcWLAErgFMbJGh-4a3H661Dfz5B8IgcBoPoM1XyETWvhRI5B6OQlrx8K4pfMVnSD0HWt0TgK8LrkXrYmSisepKaOoCQXLZYuNQLdKU_UyT7BDJR6xVnkpmwGm_J15cMa9oHw1bqLlgxjcfMgulnPVpOxAD_mUX3xWrFQgr1jOuy7e78iEYo8tupW48hiJcyGCPscLnFMWMmLYeCAKO0VDRlPNfPAMuZYqAqDlIhMsT0KyqI6I1gcVZDuqIM89NsKf3X7JN8kTzT-gtg5vD__Kqze4XpLKZCkK53wooBIVyZGfTUKKC52-_CT3t-hFPnX26_rYbIhoM5rU3y7BKVJRSfrxqGS5aKNX9zvZBFUJ8dPiczHqFOyo8-jv4rT_HwR8Q2m6O-jL7-cVr6jTuWymF55keBxPZjbcdy4N732sLO5AB-jBHtYhlWYgXStZWZP981sYuQoxzJi6Qyc9laHL5_Q9jRUFliT3KR-U6hsme34WaTH1Gis81KzT9vSNbmD2Ap3wB2jho3WN_Mywtd2VnfNddX-2gsGDPQTZqoRJio_jngIAT8Owx9fIw7JliT4Hu1TkgFmosjm1QSLXRmoKvN7HJfe4rwDRtRcRjTesHK699wPzcx1T0_05rHBBnq3MEX3D6-vfISikiuXoOWK38Ri5z_pHvHAfPkY8SIbOQGopm9aDwEVthUnuN-DyU9RiE2qUDTJfNkKlxJSyBluXft-T9DEJJsBj7wdw-mXbp1kYF08FkiGYUXsoBQCnO25BAxdmttzhgr-y-YEFPdHafedyjc2aHPRtSy-cE8omLFBau1nbbJe6f-kjaFECyeA_up_Igq52FAoRAptuO-MKNNerA8H-jBfWHwxx9BjROIKkeZuOtFfg8mroNbsBZOS2nBRMMyTEtrF0s4nSYQsv-bflvCmV8cE-P4Ns3PXR3pREv6TvR7TH2IikE3gmgwQnkRK9DUC9WI4YW3sv5MlqsJAXd6FHD9IUIH53Ns5kntRqvNC3L_J-yoJ9UB0KkWxFJWgNV82MlEAMzf28JnljMsxnv6ngEg8-H3aErMa_N7ENjnzDhsoZtnAFoBtGqvw02BMBBp_T9PSKI6SgWmCwxrqeI-erxaY68WW2sz-OQDlSuQEJ34i_eZKvt5F8s9MGHbKmUFwbLGLJ5a7C4x1bTwYtKWjVZteFP5l0HjTYjmx_lbuCSaLP_Fc826tXQrITEW79OuXXHnUS2Iw-z6fJySxhCGWIvQ7VqdNVeYF9TNJ-uT3fhy7jYnu8NoqDavVawapDJDzR5GWLbDX-7SmEZzT_rVEkyKc3MMBmjzN2y1azgv8QTZV1uD4JpZ4kcpjTXZ_69yzAPlrUhCop7gAr4MWrU_4TQ7S528vyXHmj5U_CAlI34ez_ZfiNHlZC_mEgJBrIzVtsexYVEVI6e1VY7HNTc3pW8KdrZVwswbG02rmrQkYUM9hcwLkvCTwYxrzcOoue-X9ReUVtLvKgHh4ZHGvmXccxV4-ZPl8HZdx5Bxd841sE_fS1pByx7-gqWnkJvUUtTsSxy2O_BQR1r8YngpbWDtIsbJQ8_XDrf4foF_1vOJp80lCYp9_zZ-_uWNcH5DQXWhRB7DP1moaUPpVgxk051caHkSRKTKw3D1u3wohQR2iVLXcpbNVH1UWi-YjwmdQsv5kWuAXN_eqvTzK4sF5-0kMUmNMI_VocOLcdEG1BnPifztXwUKrSIlW20d7VtOGrk2FDYukIzDhKDGauchgpJL1jmleWxCvUaL6tU0RSxI7fs4a3XUcliDyYm8KyTioeSHc0g8x9_MVwbpcGkDiQtRbCDmnFxjg6GYTIL12eSf0Lgj74fR34nQbD2KU0qa5ISrJ8IlHVL9LI6JdfFKVoWSDWhOhUhMUDWyR2L57PCMxbVZkwELVwcu57GnrnfkoXvoiusKe8RG_lguLinsh-_lzKIxgx_q_0w4JaOsConu4Gp0_808RyDN16MQZHQ7NpbK5vZd4q7QpoydvKz_jE0VM45xpPRf235SVepAgErUb_zYJVXTnRjM8pYn6nchd61NOij7DcNOi1wYWwrMyY2UR47LNH3DT_Gbhg_6iDbg6bNyZv8wAHxBv3J1PUkV3pHul5G7b4Fgu_hG9-yGWDkJ7PtSSOKQnmZKnEJYoAF6zRsgv6sIvWxgngixW7xyYGENC7jXVlESMCTZDyvj6JIgzxe5TjLQrrsU8g0I0b9pyeUmVx5P00vWCy53cfksSvRfizXKSEm5r3iVpqbEFD6Wki4pdsnDwwBm-p_hd9BtTfoWppol5TQ7WWDbAR6ltwddLDbEZjfDaFTrt8ISKkYVf27HoBTmvowiXt-6m8z88h83b1992XmGawMa97DCfemtzTXb8DbOeWuriphXWAgwmXmpK_qtoiLCFYfuomU03Bi8dKyxCvF5K__5BTnqS2gCX5yuS5y50avbpOHUZ_uk0kZMygxFqVz7Q-goHydX88TioU5Dfuw6FW4n4C01UIu_-PvoGw--Iv_7PMpoU0DAGaKC8oY1TvMK-Jp6LEZ1b0CNyhb8V8PbvtIN29m0c9ox-hKWB0JqcuUfZI-VEi4RCSkQCqohaWwlaLp4M-ggnWi6C0ksqOq4eXJXOM4Yv8i2VCVS8-fsvWDJvLRE4FXamOWgAPUVgLSXQLmrAdgbCLdjd27F0vevHmx4xRTAsWJjDsm_l8h0d_qezwTsxtHWRcoLqlZLpAIdSQHOOLOWQABEsOxH8kuEKn5Ihrs4LSgbahJAYo-2ZSXeUQQ7928aU6-DNio-nYio3GBh88cSKWdRlqvQillA9-DDxrYC-PlIKM6tafZA3laqxzsSDZolGSeEkUBoC2B2AEz7LmrC2oh2chkXfIrRYmLaH6ZYBfE8tEwD-5E8VH_qGdbpzWvP5_zXs5ZYZdPF-5EraQqSiv1vDv8AmCabtTvJ-YddhxE7QUQ90dLMSYDw7TZi17wdMVC4W8XRBT3ABYCqV33-pSNeJCBLW3IqmNZpcPBi9XvF31rHOwdTibtFepnmTi1lCweJVpK_ynHp-PSBQ6FWK4qkDEqvL3SxJPBXwfUl4DNcAHohHy1dPk51shS8R6A5rl8zM_85r1MpONRrfVue2oYIFI-HW-ykv4H2XRgi-57wSNcb_G8X09kOigMMFWT4-yXr7FRZPATdD_QSoJfgcNaRnduAqmQ25F_jKJvUSlMQjuw2eGLyIBtMSLq6snjYoT9bloAfqQp_5L_rXA-53nqOu5UVhf9tYjxLSHgZc1fMjs2S-GJa3sknpvyQ_KcJjtAIqg2Che0cH_lVWJZCSaQsoOePgk0Pqt6lDpxgDQIIgarN8HXbu4rbfc-x1PKnRJYfNBvkwbNALJt9GaMA0pR1aKp-84eUGsI7SF_bXbC770OUi-kqxP9DTTZ3IDcESsHPW2Hf14jCrjfOJCmAEh63fQmZnPlyl_rFzgbJYMzr7pUefBkDlv4FNBMwrJaQsZIuN1PwxDmL8hK5hEuQOe8LuJdFA4bP2sJCf9dmZ2U4dAZv4Tr8O0ZcRLJkl_3enDGk4XcyGtu7GAkS4TB0vwTVWtsxMfi8ig36E1obb4iNU5VquB9qdX2AAAAAAAAAAAAAAAAAAAAAAAAAAAAAAAABg4RFRsf"
  },
  "spec_version": "0.1",
  "target": {
    "endpoint": "https://api.openai.com/v1/chat/completions",
    "location": "cloud",
    "name": "gpt-4.1",
    "provider": "openai",
    "type": "model"
  }
}
