{
  "actor": {
    "id": "jane.doe@example.com",
    "type": "human"
  },
  "agent_id": "H342ugmg0Ea-GvTpUDeqxqFKsgeirlcywX047EFubuU",
  "data_labels": ["nda"],
  "hash": "2e5ad85304c65f0accfac67e02c56eba796476d6e538eec989142845ab7a7651",
  "hash_alg": "sha-256",
  "kind": "human_approval",
  "occurred_at": "2026-09-16T12:00:06.000Z",
  "outcome": "success",
  "policy": {
    "decision": "require_approval",
    "reason": "external delivery of nda-labelled content",
    "rule_id": "eu-strict/require-approval"
  },
  "prev_hash": "2efb465244f0fcf660094be21dd77c78f342058be51ef8200a71c6615059c833",
  "principal_id": "qJtRVbgIsIjNNo6VuDr6nQ50Wj3rwEAAuR2e385pby8",
  "record_id": "0192b3c4-5d6e-7f80-9a1b-000000000006",
  "run_id": "0192b3c4-5d6e-7f80-9a1b-0000000000a0",
  "seq": 5,
  "signatures": {
    "ed25519": "CXh0uPZ86NPUUybrHxGzFx900NxoCvfgoJVSo6Qmt3R2E_phTrduT9fHuV6WrOQTDu3KeWt0ECP7bXI8wf72BA",
    "ml-dsa-65": "759OT8YFT-zrwRsMJx4FdOA7bK4W9zvgVcdNWwmzMt6Ug5qoiVVAFXTZBL7yrVfZdO0kvyUnfCFKWiUMgnBKOM5Q7XRahJzpDzgwvuWHkxfjDy9Qs0pIGf-T0FJQQ9vPbbqBUFGRH_FLblWl4DZZAglHhyizsOjvllQ-JhihDT01GEy4W8g8pQ0rsr2CKFIHohhX8w0EwST0x3OSQXSIGWUosgniwnvAFmu4pZ4RLJaX_JuKWDImbnRXhBplDj69FHBcpf6eD4gGSnXEdUTaGI87xp_sr06_rCAgh6TwSU1ypww6hpTns74_qB6-nE86t3gger7uBY0U3xP9GxOo9lfNa0nEzhog-sW_ZDE1AoxTNm0TKifBt-BYeSpGNRrAKGnRZljeK6VyEQOC8ij7hepOGwAL-rnGzKkqlSeh0mVEbn5kKroRzYIk4xoVAxUi4rMx3LvQlSRnNhnpb96dkzupfz4ddYvmPFaqGFc8K_1NASx-19BVjlJC_aioHn0vjAuJ0m2Ub6eVXy_JFYVdPf2FRvkAf-9S2LH6E6qBvlZ4I2r3tLc9-FKIfc3Y28xr1F6YsPp_RlelSP2CH7WE2rKXOBCt00Nd-Ovh6sjMhbSYdhT0BFFZq2FCy4j5nfqKgAHs-C0B-EXdKHHMMVGAEYOXm5d3ZV1hRimK80bwx0rPwPUNxLkQgpECUfvQ1ddclcYGv3pPer1Rmc8spv2mrk1pvCCg6Fcz32rLlev3ihbXjagqA8t5LYIhB6Bp0y3lcWirCe9TJGrzdSDIsSHjYpjfv65VfUZi80Zm4udjtkJfEg6yFcWnNo2nLIbSWN8CyMYZVR5GWLYQQHnLq_n0hPp34x6Qk2fsTL4CA7joEZyBJxkzzGWUhCoe8dEwWex1Ya_nA1LP1YMDjZV-dC7cczFzYyzm8BwRGqwInBHx9IgCfWmNEcCPCNXAVMpPGjsClsm18J3NU95HQYLlE9HLvPofLMGEDoOEx4XywLBqcOvrjxM5JuhuUx8f1oQzgNXBnZABMhFqQ6n429mguhYXZSfuP3804UGCBZGFMgoszMKBqSimedC3srblnJ9-lebCmkTmZ91__8Z1pSJzkFahUtVx9XSXrlcrAsIIi8MjlUius4tSjhc0nsDgQSqx95jXC3eGW4apIjA7tmJlEsJeAI1WXh9kVe6IjZbQQOwXnORDF5laI36eS22ZZenid3R62rCZ1ZKl9oRNwWzGf84e891MtbvVr9uiVO53D8hcN5vN2uSPY5Qnf4H_C2c1x39LwsVgh39dGZrDyR70eBmkfbE7DWn4rxVFTz20GJkbvlrD-nnNMZW_nmd3mbygLf3TEu1cHAaYziSeyj8eqiHcIK5nxe3Awzcckg7W60jxSAw6qeJ-jSeCSCuhf1xHLVBju1a9dOJik4Cbkh9n2o9xdrJKA5P22xwHbFYJo1FaT55mZoKv7x84lVom6Ax5wcOJJQ9-XJhQaRT2JR7ZvzNU3tjh9rD9OBXCJmTRp-uzZBwAaPt9-U1XVTjepI0ygaoFXzVJ7UF57Hkr-HFb29c58rgqLmuOPqM7hZ5CqscVIe5nI9bU5gTH9DI6xCtPuzfNkLM6gT0tM1yBRKAgZb7UPp0p_nabMVG4omfuHn5XJu_O1oY8Iz2aAG6aiBPsWG_3OAXjZNH1frrUkWnNN83stru6M6R0tqzx3pPdmMNX8z6xpT2QhC9d-y6a9NqTNhBSin2UrTT2N2ACWVX_CIvnQ3BzvBaFhiXoxGadwkZ8VZ_k3qIVhwFjY1qjwX2tt_bxpiYm30x45taohPZHHxDFQApdKLlBXA8YDVysjrRYE9aduzKwIi3LWmnMdYPB7WilqraEy83badUynCNhqwXhDvtWZkqO8iYi3way4Da74u2QnHyZN1EjDC2wTr5GYfSZPdGGGmuz5Qr5btWAxD3cjTKDeFf875MPA5VdH9GPyiAiUbSKnx8N-eJKXoKuN16cDC4w2kXqpvLkjBTzTE2OZ2SBoGbvNIiVQXNgZOZe7KClrYCbiEAd3djKD6Dhx_86pPH6soUm2Slqo3luWZPEwo0ERCJHpmtSLUYxB37gZxQrorrlp8yu5Y4_EkArggPXKaHOL8pRNIISP9YoNMaMq5dAVjHMcd_Hzp6lMuzqxmU1KqC3e4pvZw9v3U0R_3qb4GfaFwd3jx0uoc71lq9bEeGctbcyAiM6GvcmuKNFGtsMltM-0kdXzhDXCtGgCXIqSvjn5Iw1CM6e53tdKSNeVUMQm_eetzLJ1EcK3sj2jhBRrlSiUuiyyGfZefsujJB8UwvK-NcRk7aRZa9IuAYRD9ded1P79UyxO-eQQEWSaMky1dmpehkx2j1eV1LHz04d8lpS1KuQrnt26QCitVp0Dnc3pwHdfXH4gnGFBeyL7Gxz5s3N1XHYJiI0G5Ad-XrgyrVdCXRLCIvHIXRlfUaOM8AqEbLPa_JZuiK2OmF3KebFlfMNZieoXubH7uGCjKEJpRaJn73tqRqm6yaEjSQFNnfgsZm7xejeA5dgT8VlML8zvNq_avVJ4xv7SHdj9b-oWEZJSkeai3WFicZjAwV6c9d_H2p2YR-18ehv1KYtvVslSawwP86lLE9zdl_wfVAkVfZpRWhnB0x7oo9cWeaW1ZInNrC3BSSQb60tnq7mGmD-rdlxFu9PDr7kD7zFT9eEwjLCQ46ktp67AsekCL3L6mBgMZywmtu9Yl3gZdXtSJXv8k0zzEu4Y1-6dX8GTYPYmLG-C-aT0UOudhsfCYbX0PwO3VC4R1R9prwvxpN8pcaKHKYnXZZVslDi8uROHZkkiiENbc5q8dbZsx_zNvjMW-3kg2Q1XW577lwMepra2rwX_xzd72hePgOckrUfHAGG7w4ebY9j4r3YU_XXP7_GtSIggKNN8yBQXt3V7sNQqnPaThDUuKVB535VwpqyQm7iyA4FoIJjbAulLMDWcalSA5QvM-GsoQpnbMTsTE5c1OhJUv8MSXAXP5cAfqS0epLzyzOFtn_TcVg_-7cIyg0p7RMEOnUcyP0XcnuoxlNhPkbpUyxrojCSLQILRkRdxj_IjMbgZ1NilzqFqxJqEOAz7pP2JbwN9f5_UM3Xuc2A2EnFZyhjUqcsDeFSvq_Bwxaw1pb4WxVPfXrzbWbcDb_1fp7YMIP6r3skulDKQbFaCRQ8Henn5bNxdwbmA8DsBeB5ecIB7qNCse4sUmwekQQNp7greRFu9-pJwOXgI9PLWPS8-2ZFlFyDxFaoUHVCaN3sQQ70IDHGDFcGBnq7L2p6zkzX6wFPNtte0Xoxl2surlhyaO-eSozBu9w1lkbY9565B8GauwECT5znABVCEDB94sIEUvyoGaaMr0iMTwvpJEMclk-yuu4KVxvpK3jY-FZlvNFazdNwNkkKITMrQO8UlFaJWFehbG8hxUtdbUTq7U7HUoOk6K3sZkcRVNnoif4dBxiteF1jKxS8msQANgrXoR9F1wUlPN97ggSDYbG8aiGgBAo-strMW_Y9JK0J1skTD3pV7wScuyuKaNFHoMJ4Fegvf1MgVRhMj3PzP-YsryHBpr27rrXAfnBJRXZGQ5rOEs6iOxsAafvoO5rcRYLWULMwDvWa5ZaOItIh8QVCVT8jgQsRI62-6JkK2czLEteHMUFAsTqbpEzeR95-kLLWUKOXYcBGvyW77OOND8MDFtUP0-LXhN5kQJqGwu1F1H1MbheLoe69NtoMZyiOCS2pbwnCk4Rx3SlIR7KCsR25VZQNdhL_3qxH_NH_4ODyrsl8T3nml6tnIuHABcO8AYJ9jVOefvaypIwCScG3qYlJsn9q8xhH4eGls6VR2wmwCalw_NEe148XoGrQMEmdt4sJxpadOA-2S5xyEhOdmhNwjmHkze_rL5OB5KwM0uwy-_Stpj4Jz9j6-7R8Nmq6rpZbDR5nX561E79asE6pMjlFR7m5p9IiFdQVArZNT_FuxbGlyLMoskBEb3wNoM984b7tNI_Ke0tw8mQgkCnXmuxvBz0I0wAmKxOLpQNrlyT_mVHZojGlcR3mAdWZT5J5EIrbNmoE0gK79d_kEjUF1fLULEMGAX3SY4swfz1D-p6CS_g--Tx5c3DwujdKKG3oAAjoO1FzxJh3jPEpmsGhbFGV0sCXe92-owaJ3OlYIGUdxBgRqdpMSdreznocHJI2TXYg_jOw0MS48G5HPJneCqytQOXUbQ-5JywkrxAXowhVAYJwVVo4lf8u90-ZWKRgOvoLK9Ctwjtk3miuCGs0NubSI36hIeo_dtSQWmyJmcsXlMGYnuXxyIdCw_Eoj9arSOXS1-r5_rJf8tYRIvwJkU9YPC9Ls7y9wNjd3uDkHEWd4wkKCxKCi5X6ARtfsNfeI07j7hscNaTQ6wAAAAAAAAAAAAAAAAAAAAAACg4WHCAm"
  },
  "spec_version": "0.1",
  "target": {
    "name": "approval:send-summary",
    "type": "human"
  }
}
