{
  "actor": {
    "id": "H342ugmg0Ea-GvTpUDeqxqFKsgeirlcywX047EFubuU",
    "type": "agent"
  },
  "agent_id": "H342ugmg0Ea-GvTpUDeqxqFKsgeirlcywX047EFubuU",
  "data_labels": ["legal", "nda", "pii"],
  "extensions": {
    "sealedrun.llm": {
      "finish_reason": "stop",
      "input_tokens": 512,
      "model": "qwen2.5:14b",
      "output_tokens": 6,
      "provider": "ollama",
      "stream": true
    }
  },
  "hash": "e20363304048610a068535dd0f76302bdd17ff804d8bc746934d9f2253e6a472",
  "hash_alg": "sha-256",
  "kind": "llm_call",
  "occurred_at": "2026-09-16T12:00:04.000Z",
  "outcome": "success",
  "parent_record_id": "0192b3c4-5d6e-7f80-9a1b-000000000003",
  "payload": {
    "request_hash": "AVQROTn3QHBTf9D6upBcPRG5KoyXzyqUKzd9s04YzoQ",
    "request_size": 86,
    "response_hash": "XjL1syPgfHW5DsNxjpV1JydeH25Up6I6k5uB4sAfnp8",
    "response_size": 67,
    "storage": "bundle"
  },
  "policy": {
    "decision": "redirect",
    "original_target": {
      "endpoint": "https://api.openai.com/v1/chat/completions",
      "location": "cloud",
      "name": "gpt-4.1",
      "provider": "openai",
      "type": "model"
    },
    "reason": "labels [nda] may not leave the host",
    "redirected_to": {
      "location": "local",
      "name": "qwen2.5:14b",
      "type": "model"
    },
    "rule_id": "eu-strict/no-nda-to-cloud"
  },
  "prev_hash": "55d2edfa81e78e44b4b972d5728b59262c866197808630b86b3c9e14ea3dc2cf",
  "principal_id": "qJtRVbgIsIjNNo6VuDr6nQ50Wj3rwEAAuR2e385pby8",
  "record_id": "0192b3c4-5d6e-7f80-9a1b-000000000004",
  "run_id": "0192b3c4-5d6e-7f80-9a1b-0000000000a0",
  "seq": 3,
  "signatures": {
    "ed25519": "DwsVuEYHYUaBN14iAOTI1iwYjIiS6M2oBTONWOedraVDo9oaaDSm7ZwB0SQOHFW6fuVmJzHx_LZsBAXm_jByBg",
    "ml-dsa-65": "szTR9e4dnT6ZqhNIBvoG_qymkSjXMZvPa16TTdGkgrfgApQ3RAjni5UTauoO1ivSjo19IcBu3qNi3cc7ju3DOZoEJlXSyYmAf_NiAHWmn38SNaRANo2w5rBrdisc7x6bLbp9ogmQSMAqs0B2XfQbdNeK0xjL4VB-BGv5V7jcHi8ZvQ_I7pujk-FoY2lKE9Pdnalo8DBQH3xmMSG0-IcfJtBaC42t0bp4RcFGt3fPu6eJl-g8kAlrdVS4s6iER-pbPSRb9_0GTtbWUGCocMYyGSSFRq9EviLyiurojrQimFoXHF4UuqjI-WtQ7FUj14KuyXKZleoWd-ebbBBnACeYXJ8gKnOiUBuBG3fhXB9fRH2jjJQj0E5PlJDBLAR-9hDFcOcMJN3WklAQzu6aGdTQmJp9Rnx1WYRf41uOfTfnhPnH2ECBdLUQs5nMKsBLyeWrHGj4YkS418cH2DyTFduCjJtq59rgWo3huW74C4hr13fYTwVQPTGEfQkPpyEbANdbpwBmyMeiUsKyvnqj6LDB8K0MXJD-7VSYrvRd_yEVR6KusjhmQoPHOH2EqjOXrDh9-y5_-J2xdjD3wz1_VpbwYHsRKNzjTjOPN-P-7yukmi-qsZtaYxBwlCXfya7ALir-WRuEPupu7eJZcOpv683S_x1q-a09sHKkuZZXdxNjOTL-ah91eItJCFqkihLdY2qQ6BReCr02jxJigIgIiwYv_hnkHkk9slfOJwfqo32Kz1J4BkTsmbnb_vhb4fNRcQFmyj2Nx9-xzTogRH-iVpsEdpbZJdoya8EnHVahRZJmpSOrt6_B9MX2mYMfOv-p_bWk_hgXYmIym3GAlRROJz-mvoVew8neKG56v93v2jKzlzGSuC_CJuWmAIx9a4rLJi6Qsllt--qfpwQTNVkeyo3lTrk1kZxgE-yz9Gb3aOu9DSkxlc6FYCAkz5uwjaQFRPtvxylJpkPDGUf5xPyXZADQwOdlG9k605_U2-sIX1lCrA_LNKdfsITLrhM9W3QfexkVIeWfD35wJJCGK4D0gGdEKrT_4Su7r3p_W2L-pl97gMno4HFOWIJA3Az0cCq0tseHfICVXhy_u1O9d8-i7uAgT0mM06J9QO7RgamRmPU3jsiHcjGIjH2gXtcKMzsnyoy6jnc3j23iC7SfP4KQlBD346nYu2QUsZG0s-tZNQsP2VPjDDNXN-vfjH-Z1zG9a1jWJvR8NURGMEoIzN-JhmxXlE2eX_8x-NIcbay71pXZeAZmHAN8T-OwAUzbwLgkujq3VUwHU8zt1gxD6I04FhyqwXup7vw4w4iRyAl8yEGE9rO14oFnTXNawR5rhN9EQ6swJvs0yB5VVzriQajg_iHblwaKpc5XKJaJ0HAiYJSQuT2KQIZ4Zif-Cjsm4jnXAjHSYybu3oXJm3fsEYKUfKjRaeLh7dOkkuYjUrsWpeRkRkIP-gvb06aEIJyat27khcOkDvM717U7uunsw5URqikFEA_dhziKXailw38658iybg8_rd5O8tfvDaJei5i9SwY9gpva2FZdly6aTKyGDDPM22Fgjdf58WUxq0qIbJ_yTocslsCrqwQBlieBoX5yNer6oBMc3hKLVka2FbEHiZeBFAyyKPFELkvkChZWdrjcrGFUNg45BbYPSxaWhnK55OOV3k6DWSnwQTVbEvb5xtu3emG4r54Ux2jm2LpRg9e79m-nt-wwS_uAN1PFrQSmyW6tdWB1XHcjNKElCldpe0D3_cp5MyMAEX2riCM4HDt6LfPcORHjIrfIVLCPaRReL0hLpG5QqEk9jITC-ly9c6QmPMI50PvD5CXRHI5HYt3bVxUyFDS4wx7onxhOMiPUHlMeN4GyyMOPzGwGmkjUYO1-KdJj-W0lHz10lS5Nwe2F7Ag-o01yUq6-hdIKwmNHhFn9TP7fQbK4C4xITiojteUszz38E1GZHu45LaRq_L99PJPrD8HcYPp9q_OEt6RFATb8bEvRd9tqe7d0kg3Vsx8mDLeTz8h04v40geG3MhDeC5GhJpfDcbiTldcwWWvOwVKmtFVAzqQr8moMzqfR2BXJJhw81gnbeRezpjUmDdO6bt_v7C5OYjBrp3rXu2diAfKSUEwbowPt0zuCA9Mg-LkamNfVAuPjV0Rncw_-SxY-Yde5beFCjHs_jhaUCumzrO-G_hTD24wpiOphndIW-zVH4V0aQvx2EN4AleeWHlVah3PwSBgTXQ4KLN2HCI13h8AGXzucc9oAiT2pV-NltK0k9Yp9dA6wXcenWAbwahnstdNvd_Bj8_RU3Iri7l3Ehs_LvHsRvTnjAOZfEDr5g6Iq1A4paBLc24u4-nQIrCqysFZPrvGEaAjUctIi1opHOLLgNehcYZjdW0Ac09SVJ8dkzDMD1pnCzKV5zTavLESB63xGn63Wgsy2nOT3g8W3Jjd2hz13Ahf4m4leZNMKupUYn2bsZ4oXg-FoKmWRL0qgdqfvTEEZkZDRYOBnOwMlI9zNDfq8odVEvLRZ6nNnu6eNX63LylgWiquSk2ztJjV65_KwsmSZP_5EFURqAqLjy738qEMiY_ZTuaNSiBjhJNoD7AGzcZ-CR5nESHx-yrhZkTCFxJjXRM99AmtKi9fLw86YIumVeuCFFiqFTlesFBebUqoYxnW7hZWEqCox7geyZgEF3jVuV2zxB1C8YImceqkaca8z5LQAgaJs1YcjGZ3CGyvzKtEOxDlO33cUkfxg5vqe8UXHmffbmlvZ8fVs-E5h2qHV9SHCNZHH9k4m8QX_YB7ecIHh_C6ItsGS7XfEEV8DQHuE4WNBAlAijIKKDx9f7GeYCQKKNNgBrlPj9QKZMZ32ev6h5rdl3a_u0SnPzG6oyDN6MIJ0uBJ7jHlvALlRwFf0AfoxbeKOtrlnMXaKA4I03vgz5OqSmldy_CdNTohBuchqFTt2Wh4hciwW9Re2LzxLQyZHTvjFRLUlihnqG1vyzfwHrr70y1xIooWN-fShjwVs4Q9IXZyR15hHgz5KM-60CzTJb4gYhjt7gRBmfnnH-HoqDtUjT-vCZSiv8PgSMcrH2UQneOe-DT9Pmc1E6-aqZzLO5KOEEzMqxv5rNoOAzL4cPx1Fm8E_euWCrcI1J624Xl5ZgmDEz1wK6qH1cVyUzgMUgO5UGMn_8C4aHUNxAHyLoVgOp42V4qibqV2t4ufH6FpFVw5TUWlLtfY2xpf4UMoV7lubPVl17fo4LLFe2kPNxiFKHmMtTpQChYnF0RV1utAXKB_7Kz_IGZQ8P8Dr3zFp44uCHkzMehE9_8nmOjyq0lmkyzd5l3BFllKBFWgEo_WTRN8H2W-R3AbHYk-3f_mUI0hk8f6twfab1P2JQ-bpZHqjbJZ2EhVjMizBTIEfdE18P5BWKcU6TXiPn0cA8lOMHc1VdpdQUYZBQbIgFhvat91Tqr6-DKY9KfpsKrEqptAGE5FTtj45awS8Kw2AT8jaOKEeYy4FNv-8LLIBLBNjAYQSiQpdgRIxBrtdwCSBwYMUPf06e9422D1GTC2DLMG16tDFryylel4JjrYgY1H_0FXgdJyDaFd_3lBclHNvk7HTFHk622BViLahVMMBZfVZa0vhurW9e05T4xCDWX0JG13doVFUQXVWaOwjZb-0XZPWY11b9wGLA1Emt1YwNFr2JNQ1qQdzEImwnpIOwL6Bt_0BtfD0Oj2s6c4LFQwqisqHj8JYVchA_hI95V7jHTeTvUFGX4L9aH5SFOI4CIU_G8MGiBjQ1U6HnvjxUdCC4-YMhXgumYfXXPt-DWU8HpCyrBLSs_01OIYVAyqQUJRLswu9ruVKUUvhxVxqYx1C3GgEUW68176XQvzYwolG3YIXaxYgD7AhmAnhBAsNp89ND2q6hu6MBag9DU9iUIBPoOUrp4SK6XJdBiLd_z0S568Lwy4hwNzYvWKpe-0MUnU6h0n7P-Bjif7ifQBE2NWyby_I425-xbnbyFqe-vRZ6qOhH5aJp13NGio1L7Uin6IpbDTcncxei5cgBa3hb0vU5lv1uFCIlvPLHOjCOsai9EeB-7ZAIbRwq5_LparptltRlqaLogR0-keJOOI7SydBrmWl3yWahO68E8Lo0JALXJEVjmNLigt8nzyTaKa76V_utMTU_xRMv9sOp55voLMG-PaPrfJ4Af575isQSdwi4vKxtxu_nBGIlEa7ST56t6oIsJE6Tt0hV7EAPm6hNgvmPhBMl75D6H5qn1e86JdF8aGSpRZ3_6ok-1ctPQujQ34mWwbzpaBbUNtmWqvfRqmqvAt0UlyjCEhBPP1s0ckL3JrFMivit-19lIwbeCgi3lHILiElF6fDccigw1cVIEZKU4IIRGl_hq7MBCFzg7W9xOb4_Aded3i_0-ASHC0_QaryL3R8y-0AAAAAAAAAAAAAAAAABg0XHiUq"
  },
  "spec_version": "0.1",
  "target": {
    "endpoint": "http://ollama:11434/v1/chat/completions",
    "location": "local",
    "name": "qwen2.5:14b",
    "provider": "ollama",
    "type": "model"
  }
}
