{
  "actor": {
    "id": "H342ugmg0Ea-GvTpUDeqxqFKsgeirlcywX047EFubuU",
    "type": "agent"
  },
  "agent_id": "H342ugmg0Ea-GvTpUDeqxqFKsgeirlcywX047EFubuU",
  "data_labels": ["legal", "nda"],
  "extensions": {
    "sealedrun.labels": {
      "legal": {
        "confidence": 0.91,
        "model": "sealedrun-sens-v1",
        "source": "classifier"
      },
      "nda": {
        "confidence": 0.97,
        "model": "sealedrun-sens-v1",
        "source": "classifier"
      }
    },
    "sealedrun.mcp": {
      "is_error": false,
      "method": "tools/call",
      "request_id": 7,
      "server": "filesystem",
      "tool": "read_file",
      "transport": "stdio"
    }
  },
  "hash": "55d2edfa81e78e44b4b972d5728b59262c866197808630b86b3c9e14ea3dc2cf",
  "hash_alg": "sha-256",
  "kind": "tool_call",
  "occurred_at": "2026-09-16T12:00:03.000Z",
  "outcome": "success",
  "parent_record_id": "0192b3c4-5d6e-7f80-9a1b-000000000002",
  "payload": {
    "request_hash": "tzkNu7TAkYjO0GgxHQm7kHiLKuzk_KKERAttOaarNKA",
    "request_size": 67,
    "response_hash": "Jm6tzdPGE57XeprZfJhxH5wsgsTf-czFs0fwo4ywM6E",
    "response_size": 67,
    "storage": "bundle"
  },
  "prev_hash": "413aea3b3b6f79d6c67f7c07d1fbb46bc797f8242b001f1a9bf4e71fbf9d48c3",
  "principal_id": "qJtRVbgIsIjNNo6VuDr6nQ50Wj3rwEAAuR2e385pby8",
  "record_id": "0192b3c4-5d6e-7f80-9a1b-000000000003",
  "run_id": "0192b3c4-5d6e-7f80-9a1b-0000000000a0",
  "seq": 2,
  "signatures": {
    "ed25519": "x5GzUvbCmX8WqjuwE-WMrhZty_frOr1evNF31uyDXQKITZfMKJqF49raxQsos3fp0E6cVOrVbOGubJuU_utZAA",
    "ml-dsa-65": "5n_Zyt4_JCkC49kwK3CiPNCpN2jzf2qfuUTTdJmXq5hXXMAriLx2vctUKPEPzF3aDdL3eNQdRWS6Pa5d0P7Gta3BrBtqfx5EwD0EAzdFE6YF46-kUvStmPhIKdJzVGObCp0QV8NtHqw0g10z5_9nEZp5zyEQg1AIH7j-skGLSpYMHXx3Wg5-D5f8oZU2GkNsJDkD_gxC0MLcmZ1g90c9OqWBJ8TpxIq2VGIUu6fvdDef0ox4TcIC9sVio87vTtBHnNF7DIw39uetJ-xM8UZc2wHZX65gbMV3IOEwUhNNMpkBmGYg49t-q6yatdAd5tNL1aqTs0wWnqr-k1WCHM5fOKK4cLJ5--VQcaqOea8NtYM03_eLEOMPV0wBt4h79usk8Yd5kPiYFPPR7nwBWbpMn97RA0TGdC7tx7_tlZ-5T7bXfXFN7AFK7WDcqOofZ2Li7qwnrlWvV_FD-lOxV921hLtCdTUkV4db5ZFappXiuhIB5tWF3-0ua95zl-eJhh7-vfRqZZQclU9oOhJBZKrkvRbIQRNnQ3xDlOONkVweBhjQPDAB4kn5IpErODxlvIXvgsiSWaNVeEbyS9Xg7NseEl5jyoCBRiWmw-6_qQs13nRjjqpXQAbUiXdVCQOurMu59ah5ILZXwSftg-JhKjzRWMYsMph4OFDFOVLqeXHINofI9i9vxa4-r_xjAJhzeKq5z2d2jTMoKu0U4StfDCSvcpDdgza8DwDy84mflMx2Q7I6vtD-mA-beGzx_sw1v-wn2O_w9WqqxCDUwXus_ap5YPABjyKPmZPKU7YXjiQ3pWvDceTPz40ZswCnj3CtnumQ5A2cd97t2gQZI8y834XcYuyybDDr4ewJ-a5c83Or8eRUlrgxqMcjwbdAmuwO6kgwWGWZ1i3pnqYk95jDIlRTIDmj8FNK1j766S30EnjldLdwZKdYf-y04mpP314F364pTq6d3TxoYh99NJyulPyLrjaOd3jAjPs-2idcyig_w381OYT_NhnvYjMn_pw2adOwTiL5JFmzWN22Djke6lP5FCZ_MdnlV2BRJnlrqiFAwsHhSJu8w-MXbds5Jm3rGKGWORv446jQFS0M1mASwOA4HtEjGKTB179fFA-BwKwx5FIy992Qym4N34pZiu3sVy7JUg6q8L2xuXQyNu2-addvFaZZpYB0MgX0JTwAN3I0APHryU3LSGetpVqcmvyzNxThCNNTIILHVDJqyjR3MZMzEPDJDX8l_hb5dbW19zhFHdIi3R34puMSrztu5pPczLikqG7Nth7UVOhghSTDf9xIOvPxWIWnWqDCiGt-a33w00e6S60Ib18wd-LJLMbq7NsjDPCboE6ToV-VVKcB9mcMYJgT2gdK75vcr36EgDkqBE6eMSZ2IfCHbeTweKK2yJzG44dsRfkOiRRyHX3islvPaH-XDMMW3-TCh62JzOsNzq65okygje2edPFnWg2EFWYC1FX2saMYsZsoe0G2vPzpkBK1FSk6SAMKJ3i0EMZgrkwFW23srqp0HHOY6jU6vGFxO3bvaU35q0YXodKPRm-25HoKsCC3bFfRrGvvY-0KRbO5YzuzHD-Ll5maQfThESr7vyEVFnLtYrsNAIWi8m9v2iBsXj2kxDKRlNpqqCwpOFPol8G65OvxVgMtQkmwfi2lnOJEHMmnBBZ38nDWOFNhHcLMcGqwJSYa2dfpmFJ3p3EQcNBnGOi_E9lXXNuuhjFiKXtrx9EPTwpxXKMC9a0iwgR1vCPUfIcS771d9m04WLntHDi2OYWVqz0VZhNqVfnAYda5vTCBlN59iBOFjUQyvjIS3-qBRSRwHiQlygTKtyi-NZU3fYwormUBk6iKT3smLxGWH1GDgu7uutEKYVSWqG43UT7smDyAzPNwbAIg2x0taKqJdfH7GJ0VeUvoOjdDMOJOqSAiiCtH1v8IfKFCiEEo28ZlTz0g86M08bVaxEeesnKf8K4vf74xiFJmfrgjb_xmQ9OM7WfpHKu0Lr82wQ7JyP_ZPtWcJLYt1AesntAb4rkM0YapI7BElSUrTdpJrpmaAZjVuEIazY0i2b8Oe0jdIFiA1fvnJrRTfepULvzlKYOBUB3QhsgrRDcsSCqfG9rXFXc1gkIdrKPfx5UHsRFk8JPgLPTHcpeG4b2mlWskx4-WuU4G9iuUpInntVzTE7c-Fs1Ydu7QZFkTdZB7GVG8VZbRkQlA48H-6j8yhZ6vK-ehUCiWSwlAuya4-J5fQy-wbCIzSfB_yNoH8vnT7THUQSDvXK15osriqfDp98Q1ILX1YVmfApIhy0VJvG26mZ81e5N9gn27Gd1d8j-ZfmVNy2EofrbZ1SqzWGMgzWjK9E31jG9omWIM9uP0rrHXf1zliDG6u2fGxGXRfHpI3boYtmCLD38d5V-x0MuzBxgDfON-jvetZWqAEIpvhyhA_QGYeuXrWhbGepcY5og-kNIp9M8wHQ_-v2klPWo0DvxzbJMAGCF9XY6eBYhQeJlkM94yLy2kaHyyvKCBMej94GxvElmVhlAsJHs1YlMbfymPwF_l8zQ2as4glCrSWVC-6ggJgCeuwIcJN4_dW_mayvlluxc-0DxED7vRtzBkOmmGgZ1nqmvnTgFj9lsmgaa0pKXPJkHI92Iu6Qmzx6vFzIt2440f0KilQJwEi8pj77L0SThv2CdF3u7gwF0pSPdQOPo8e4t0rCP4i6Y3Jq9MdjkGaIOxOGrXRjAev8goakN6pEGnEs74i2IJ7ucUjUUUDOJx3IaQwfGjOJYH7gHg0pQ_CkruIO28Cdp2yAc1LZ6bpCy6WrehkKD-1tVcQ5sfVQ6zTWIMHwNaG1DY4E7ceXpRk5kyxDxUv8vxW2RL2N6qDeybP2eQ-0sPJYQ6nZoVYOWysdJH14pMuwya73oAEk2FW4xkNPnvop57FPQzEPJeAktDuOMNhnHBJU1gg1zQ9vMet4AM4M-BaEzdGA5fXwOlHna_aqi7-BTGA3IDRB4HUPPHIcTJXURZ0VF8hWNFs0cx0YQsSBwSfJyYzhKRRjlCTe6iNkgJ7gbgFSsBfK0Webk9PlS7nGYMJbs4kHhfH43zvW2Ltp30M4YQn5f_pJ-ttZ1QcwRgNLc9WC-UJGVhZOqTOfdN_yb4cVMLX1H_qW-QleqhcQcA0sSSaf8MQ5Xd9H2loiLq3heDM37C9CMNqEAFzTnpAJ67nwi1JkJOUrXwzOuF78W9rFFH5mZB8jg4rUwoLqytTBiTEbgM3NBsZIvqGSUi6x7IayI2c1Rp-RKnYe_nXuFXNxKzzRtRF5zZatmwBBPchHhUQAyg74FyfVhyhYAJbBmr73UqvJzakjxMSOAmy-UAqOMmjx51asf0znCmJeHbMWgHW4YSHvKNmc9m9oRO5CGfznVCue9iYN3XLajLlT1NG_QMYw9yILpFSE_jYsh9Q7GLr7LA8Roa5-JhZyWOz7m3Enk9VKFGMBzpz116Kr-VZu5ouTwiasWzTX7NdhVpYKBiCc1K7yGVL30Ty9LwnTR-SAHV1zDyhKA0FWNRzO-fz_BXXW2-jWn8ih_TjhwCeG87_nGvZNSzIoH2FVGhJGA-U-kyhNlf3-jU8Fv0NRNdHB5L4wMwxMfxwLGQW3alfyrM75-6cG9LDnu1CboVA8OvPIRKY6PZ0OUhvbYqcedD3ClMG326If0r1fVh_8DeDEayBuBtz_6bESr5HRcFtIuzJqUEJntRBhKZj_mWiILS8QeuZ6GZMoA6kiramVp8B7Afd4B_B4xEg0FmlGq4KkYg54RnDqMwXFJshvN3BIeCOvM6mu4nys4Y-7LPvUOjr6CviBTHXcXadkdXInkj2LiBWn-yPYeRvMAHyAmQIOqW0J6jrC9sDUhtiyfBt0oOv9Qh1eQl_5UQ0woARmLmshjs8vP3tgHOZVt6MeeUrJOKoP8QTttANtLDVjC3nQwZ5rohfv4vYjRrwqZB97hYNXTRIpkhnAHgruR9hoaA9gsXSR3kDLa-dNQFzTAISMbn-_9brvPTu95r5Vl-5HXi8m4b1Vq7x6CManVPp1QbUhjroxfzDuDFd08NckMWRuA3JFw5KbcSafcnOp2KfM_OgFTdJWm2v-w0jeDw3dymH-ACIMzAmXp-WHYlGeih2oz1HZUxcUUENNY5FqrOxpBWps9VVM8ikWJbbhJcAXxJPiwGhsw8z0mn1_mjmpk6wiWPbne1i6x1vMkOJSxmmoI96NxurlZ-W-PyF91VJPS1l5jS9OtWuZ3ipRkCmOP_iGQ69XnKAWJeac61DG_-wNMdI5oGuO_Obj-t2_ShXHPM3f2gVeDYURGIJimvJ9k8vDnk5Ne4ukvt8HkrQXO90N9pm6Ws8_wHRViCjpBZY32fxtT-DBFGgdfhJTJDTJOVAAAAAAAAAAAAAAAAAAAAAAAABgwSGR8l"
  },
  "spec_version": "0.1",
  "target": {
    "location": "local",
    "name": "filesystem/read_file",
    "provider": "mcp:filesystem",
    "type": "tool"
  }
}
