{
  "actor": {
    "id": "H342ugmg0Ea-GvTpUDeqxqFKsgeirlcywX047EFubuU",
    "type": "agent"
  },
  "agent_id": "H342ugmg0Ea-GvTpUDeqxqFKsgeirlcywX047EFubuU",
  "data_labels": ["pii"],
  "extensions": {
    "sealedrun.labels": {
      "pii": {
        "confidence": 1,
        "source": "regex"
      }
    },
    "sealedrun.llm": {
      "finish_reason": "tool_calls",
      "input_tokens": 41,
      "model": "gpt-4.1",
      "output_tokens": 12,
      "provider": "openai",
      "stream": false,
      "tool_calls_requested": ["read_file"]
    }
  },
  "hash": "413aea3b3b6f79d6c67f7c07d1fbb46bc797f8242b001f1a9bf4e71fbf9d48c3",
  "hash_alg": "sha-256",
  "kind": "llm_call",
  "occurred_at": "2026-09-16T12:00:02.000Z",
  "outcome": "success",
  "payload": {
    "request_hash": "NE7Pa20znmfVURQkSpZ0rJeNoY0Pg1xXL5G5kZq6RXI",
    "request_media_type": "application/json",
    "request_size": 106,
    "response_hash": "n6zrlnqzR23iJU3RGI_0RJiFw8Va196NqWza-Nitdq0",
    "response_media_type": "application/json",
    "response_size": 95,
    "storage": "bundle"
  },
  "policy": {
    "decision": "allow",
    "reason": "no rule matched labels [pii] for cloud target",
    "rule_id": "default/allow"
  },
  "prev_hash": "18d39e849b52694684f84e1c3157a832fa3cbb6f58b4528ac3adabbbdcfe2b24",
  "principal_id": "qJtRVbgIsIjNNo6VuDr6nQ50Wj3rwEAAuR2e385pby8",
  "record_id": "0192b3c4-5d6e-7f80-9a1b-000000000002",
  "run_id": "0192b3c4-5d6e-7f80-9a1b-0000000000a0",
  "seq": 1,
  "signatures": {
    "ed25519": "OuNSRjfVC23r9hWyT0ArprwswwPVQyfUNKmYuSA1KbdsbqGd6mDkCGuwI_Ux9ZD1U2mjlAHz6jXgzJgDnrNIBw",
    "ml-dsa-65": "7OGpHPcY4iMZPpyH_9yV6fi8ckwl6fcSknwIrOKGOtGmudYKpW2GckbrrOhLX45-AZKJgohh80lp-CImOvM8NEzr0ixb6UF-hLHI9olf3H2N4WHz97JDXUzOSNtYD1tIwefkrGz8i1l5NDZhGdrMUO4r9Pay4HcxSNSl2kX669BvOBIsrvhcFfw4qT5WOjf976ZJWHg0ghmKDKqXGFJLn4L61JWqfZ8b0ow9LDVbrPVmTVJ4JU0QEKOA5VbC4CaK0BTYGlpP0p6PjSaXBo1GFK0q4RExxTY7reBffx9V6u59o0DsqgT6Cqr-2iNgJuvsGywMWgMMi5rOMmaJDSvdFWr956mWQliSlaqCSJDCgDpe92FrNJSIbO_XABaE4Hgep1sVaDElG7B6CL62QBJhfvY_Q5gPol87GBmDP7EJEZOSB3qQYTnQ7Zux2cbQZLhzjP85mC6jirw4BnwPOTljPVAvrozBwslYUt7dOoky_bXFD4KJOlIV3vWsiI0TMzXc-mpyJUwLX1iKE-e4cvmJ3N8MrtCJXy8ZNjUMFa65s_QZdyMmIFFsg7cgFhXg7FyZttlq0sdIo6-npJlMS-l2RsbaZ2KRQHLWs6mDealDIYBxFevtF5Hlry2i6EcYVG01GgklzcLB76YY49F8x8lSihp_XAqAjTXBgg1Yr05a78DIIJEfhf2tIDZC9wjuNnn0LNZSGTLRnQyYV-HXKZ6Xrt79XoxryPrf4Ph0xMnLrWb2f15vmnjKEfxT2pzCk4VNS6QcDp-d032DRjZBp1dpWQ9XGBD2PK8FHPJfJU9J-R-2GZp_VuEKuUi5lcijLOKSIq4w8fbOXXP3FqkXgJ0QJKOt1c2l1tnb4ikaVSIjiqbkvh0n-RFCipFNTopj3hVjvNXDozmXO0ztlXXGOAZphrYA_Sqzi29tzoBuHUs577uEtHLt5ElhQrwS8YeGRuL0wnG6ChgyJn6ai65tR93_Tgzfg6ijK83cE1CJJF1sVi1HLomHsDK4I-QZB4yIp-EMddbNZjuWrgOhz9GbA0G1RX9Z4uzVx4-5e2dqjvEG0WAGJK_B64kwl_-mBRN1LgSZ_efpLSA7W-7KFVZAFuckUgqn0IUWmI8NMWVgn3cl31N7r9ONBlcRXmZ_QPnoLjEJJGam50CKuq6EWKwOKnEViCKggqo-XHipziTjQ1K6HwhNjv2tcgqkTW5bk2LO4kcWKOkfaV_4Ocfdo-bWizwuUnJgu3Gqbt7PuWKcEj-ZrujeCsLAmWGO9MhAtprTF8FwlQKgnRKjtegcNaRPKl5_pt0ahSkJMFd5FMbsRwdIEJawe5PnCsYLOC0U0NG1ir_-A2yDvUUKGqXv5wKJXrHnOZy6vvTahK9MHIaLU5iyIi1ZvCQYf2MV6rUXmY6II2IlB3ZceJ8d953vFl4LS55vIQRpokd2uQUoHVrV99b9ZaEdQdAgX-FGlfN3lYVHcBJWYfCF9dj1p_1OwBhqf_N8qU-AO80xvuxH88JjN4wpgJxl0fu6K2s3OVRr-7kdDN5o1wriw2qw20PU4Qyv0ptql5CpOKJe4zo3eZnNCjy4LEbUVuuRK7AKFBh4Z3rYb0sS3Zzcl8-M1629o7Z3cMCGslhMLoW8kfo67Cr_gCLL2lRuDWGHDSKJONsu8tVVwRX8z1v8eWp5JTsIJSJ1sPwRQDQRUKVfvuKD4f06XUv0-fzvstVYsDfllZbclA2qOIC0lsu8kBwmDfh4KxQRlM2qJwj50jEHokqzra1vmhxo2ujw97DgWBcZ-VlLYB_NnT5CvblmysdpUaLVVdGaZKQNStZFz0wD-tlaFWNBO5syR-tF2Of16qEiaxaG_qsngG5RoJB6Sc7an3l7r2jf9249Xosf4wAgt_VOBMFQQ2a3rUnHFiDoagU6Ztwv2gQBsQRiwZKcOP0PV1726sErVGxvCH2q7scl9Ninz8A7nkA0DxY5Ma1V_vE1XAbIAuXRaVHyxDrEL0XbTphMD-XcAg8NbG1edmFkA9XUZsFydOClq62nVfd_jRzX-S8jzjTsCz_OSJNIUWZ3hpkOFmEv16O8NvbEboSQ2Deor7_PBSjf9H2G7Dp5bhcwAbXGKfiXiQbVEC91ioJgv-_mxFxVNVAFA3nLDUikBf8tg5bTrDJBSf1dLpOl1wm8ESGwn6J3ZN1zIIzmpO7LzrZyalQKaanjycBFjSjzz4upEL3-vnXjs3CM5iojVTsIijSWL5LxfLSOhVZk4wDf_RpOkxV7I0nEpfVh1B_tzXEE2DKG2m9nabw4xSeAZIJysY9NU6c28fJ5i0iSr47LgS17YxW0UMU6FtZ7YNQBUmboaFcZ5stytEgMclSYqn3-QHYnrwET4NxMQP5RTd_P3VQhwF9dFca2GxJHSlGNFKQYXvOIqQ7oooVbcb43z8pUAL-vVZ_xj7LLk9HXtHQiFMJlf8grnlNO1H_esK9IKE8kJia3al9f7IUblFr3Zydx799l2SQkRSoPDLCaN7GQ8G-IjXJrRe_F95onuvIm5DK-v8k_hFlsjVBY0hn12LSXyShUccSidxFjmzE4IJdU_Ugj1lwXwvAHp4gPw2Y50Sc8BuxEvTaoVt4q5Bnn8u24DWN-7uAbmWdrtaw2eZgRnaBkmnHKGsDh85cYeD5hairDxkZ-jqlPCxOk7zKBaHwOW4hw3aA__8y2wxrzLU_7qMC6z32jOIHJga957Gcnkd4hXwKmrS8aMiTIbYSfSFUuk2sxPEdvEb2tw3u_scbTY7_Q1oOr9_K5S8QsZv0x_qDB3zcZdc7_jdVry9exhfRzsC4wTQNm3s7PxdSb7hgcEGEKjrhSUXvZVhB1Vsvl0tQQI59TqgJrLHz1I6ykN6mVtfxpzKZP0QZF-b7D3mdqAN5BAiOsYZNLkGKdMO8lmH5QAxcEdTYsHdnoCGbVHE7LgM_VarZqi1gGRLl_hh-CxWsbCJVe05LxacWE4GEcSZHWvTwS7pMsnWkiI5pC94y7kgzTtphnXMHmhbg5FFqO3aZVS1jW1IvMl8-eHpoGwY5CBK5Hy_X7-eft28EQvAS29uIDMtIaXJS26hWV7-oR3-eB5gxylAYb9Od5WlVKBAxhknO971xX2fKH9NXqs_JVM1m6YxZfU1krw95aWN89P0xbz083Wbu4LXKkTNAlIDGwLATTUC1tfHpTfgl79aGyb7NjhLuwTmkh5-A9FzrDLE41DWYvth23JPuoTp9r4vSwaCBh5xOr7H0p2ZlzFtPl2nbvLu23fZ_amAm6leJgnkDI9Z2bTMtrQ_htvGHsOvoXKA-fB2v_sjUd2CckV91QVx2coJUMZ4gWcO1DyXqZFXtQNJE_ZLMCtLP40qejMbeNv9t8fFjH-gNMiDbo54B76jCKtMk--ugr8SfsGCn1vHv0yEV9b-ifNDUhekF3u84EFvHlQ7FVTmFR5DwK3_qDomo1KmhWWRQuxs3gvPN_qfCII83h-U8h0F1UZv7LFNXCZIwBt4udz1frIt3fylOTtml2FTUte3azr2z9s3SWllHSAw4VWYzH_m_svT5dznfhPK0OJIKCK1XROeYxDsEgqG5zmGd62i1ov3B_Y0V4PxT0Wushun_LH93lFj0nixAg8QVydIgRCp1pTIiXAIaEZYqJzBkKexoCd0jCyH6uSEVD8oML6vsoXeopKocDQUjJyrvpwnUE841i0oSv1r2VNxFuCTzy_wuKvXgE_25AF9NK7TSUbfNgsdCKZep6bD0ToLMeGdcs5ffoIVOAaGW2HkMFEsndbrp6xUe0TkXBDeOvAW7fdAazAUPAQwhSjHmpRYHgEAHovO3CU5GZr2w_1TYXVV-UY6TZoBx_-j3yi69zzac9lVo1LR6_wZrMR2LCSI3tIT-arVlITjepvTDQjBIZ-YOgMjLpjVQ5rUOR2G3ybHw7JkQw5mLHyJMAXBbHi545sJn9J0Vqu0IJ7ydt6MTlaF9zjw1irHx9PGfycFed8iDEf0LBHFnnNlsn5Kiwp1fV71CIs6pQ5fZxkHGb-CWKhDHLKSAUDSt8eMzjdbfWkyzlxxkcomVJaPoWHGW5cUL35tJBl1YNhxuzoGeQZgnosI6DQod63iJUvAw0ZiTgwnEYVuQebmvqSD6Izc4W8TTxZFoXJmy_JNQ-JQAoKEJPAkp1XqRnyPZcYHr4SJgXjSwJRZrKuhRGL2yclCUODd1j5TG51yDVNbHRBYsfGE4eaiff9MDA-3CvDQs6VuwtpPHpGcgM3lwR_J8M-UZXcOmb-us5GOtdzVMO8ZoHL3rtwJIzuGIV1jB3xYMsCeUtNE1HpvsaL614MKajOxITn6GUAmyiTAASRFd0jpGZJ1NfhQwvRfP_ERTP4eVqkJFERVTJ0t0AAAAAAAAAAAAAAAAAAAAAAAAAAAAAAAAABwsQFRge"
  },
  "spec_version": "0.1",
  "target": {
    "endpoint": "https://api.openai.com/v1/chat/completions",
    "location": "cloud",
    "name": "gpt-4.1",
    "provider": "openai",
    "type": "model"
  }
}
