{
  "actor": {
    "id": "H342ugmg0Ea-GvTpUDeqxqFKsgeirlcywX047EFubuU",
    "type": "agent"
  },
  "agent_id": "H342ugmg0Ea-GvTpUDeqxqFKsgeirlcywX047EFubuU",
  "data_labels": [],
  "extensions": {
    "sealedrun.delegation": {
      "delegation_id": "0192b3c4-5d6e-7f80-9a1b-0000000000d0",
      "hash": "cb6548d033797d8084a29b37a9ce9dbc2bb81729952d58cba9554512a9fc247a"
    },
    "sealedrun.otel": {
      "span_id": "b7ad6b7169203331",
      "trace_id": "0af7651916cd43dd8448eb211c80319c"
    }
  },
  "hash": "18d39e849b52694684f84e1c3157a832fa3cbb6f58b4528ac3adabbbdcfe2b24",
  "hash_alg": "sha-256",
  "kind": "run_start",
  "occurred_at": "2026-09-16T12:00:01.000Z",
  "outcome": "success",
  "prev_hash": "0000000000000000000000000000000000000000000000000000000000000000",
  "principal_id": "qJtRVbgIsIjNNo6VuDr6nQ50Wj3rwEAAuR2e385pby8",
  "record_id": "0192b3c4-5d6e-7f80-9a1b-000000000001",
  "run_id": "0192b3c4-5d6e-7f80-9a1b-0000000000a0",
  "seq": 0,
  "signatures": {
    "ed25519": "bm8kBKBM_zcj0PxMyDIbJBMOTxW__X-IxoN6gtasd4TF4nQEyyQHyVGU2RicLh6apQISin08MSxEbDGrlwFtAA",
    "ml-dsa-65": "biDzx8MeZlufs9Q0bTRfNQUt8fao2f91e6lQnq-t9OPgeMI6vgPDoe73sLB4dRKopfNPsqojsW2YxJRKSdcAj_ZqV8YCOziHYwVfgbZVuq9pjMvW4SpYAdSfySTvtIUb60hxyBo_0xnabsk6u0ws6ZbPHle0zKx5vEOfy-vpdNrtOB4-nhAONsYY9Wo-ZNpzSSn4F3b49pPtgVpcn3Ktifz-4hzV-BlUx_ck6MAPIh7Tai8vnAvEbiLrEwAJ_mqMw_xFrZPfvHQW5U1kf_B2QZf4EVa-FAoUZUjNRXtf1Pf5oT4uW5B0Fo2zroZ5DdfRfUcYu29UuAEnl4DWdsiebBoL4OpVSfGXz4GpgfuoW3rFbKrSZBvp_j0KyJWJuKqMVgNuiLVJngykLozdtjGWZqmlSxN16VDde9Dyco1TQzPT28F7jxxPMow3VLREN80jZ2gsNFXGBJf26gJn9eb97k8E2Evtts-1dnRIe2KGH9X1MdBNFQk5BoW2Njb05GRyOzwI0PQ29S83LuDRgdKQLBjOar1tDAuWEsZHIhVlXmJYydzAKVIiWrGdrcY9p3Z7r5w5NTxVe1HbGdxGbI9uhvga2Smf2o_3oOQu08oQGwAm2Afcj2or5CRDnD5pobGnRk1DYeTd1xqyEZH28AHUpKJXfgOwOu9xqmhxortmuhHsFfZLjUMhcUX_QanMftELmxUN1OGOdZWL1cEtyPdOW4QS7NCSAyqLpeFATjjNT3mv9jlyqUYcTZgsrP4QbFv-qA1yQ-e-nkboU604H4A9jVRsgdxMAk6vcH8fEXdLLymhx-mPWvgxvoCUG8Rx5Z6FWnVgEpe4gY47ECfeFdsiwxdS3T4GqqIVPLiMTHAFcEO1vJVzhnBhw3pDstUlTmxANXVrIjHsZjckXbEmIh9zOBnZ2pSPy3PBgu1Jp5TxP4aG33l-0ch0SPaZOaPiAjWD9P9Pv99zM5gN6TlfXZR3uSqm67rCsMi3-LhD9kM8nDKNNo2fK8iL06z-YsCrvF6nsRDy-ON8HiztxvRRsZFFiibhCc9yeWXM53lMNNUcgoGs4DLY0TaIdoZC4d9DWxZsIla-e06hAH0XuxjLdV-urqCKRm0Np6r17aZGpQnccGXmjcKuzcLOgfYM0VGTlfK9SZeGbzCIwXWlVkdQpL4tg8SSMxZ5GlGMRKDE5AHFT44UI9lV1VOruzRw4oNK7ijxrKlcHAAdtOrQBujZj7KnRGpxSGsvEzNhojVHUvO9-P4AWQP4PtNUCZxbLYJWFLSNWkGpYHmA-deiO15-w2rZnOl6FyVWsv-WxvJRo8-rX0GQ75-jsBr-Ydp5K6b1tu6LLed5xYjq2JKIB5u5tFgq2fYf7cHM6L8rGvmJZXw42mmS4KiAXAWJfCVpM1B1k3A42w1Bu6Lo-p1F_nwzv2cWBPcnWXgqiVpr-MY9NBQydINDBFWLibRt-C98tw9yQet4hzeHhquh3ZQHxAnLSZDTtoP8ZbJ2KCbq3njKuJYXq8wuP8JGEzpVejMQ3tz9xOValgW2hmAPYqDvQtF-c0Gxgv8d-41ZqCXmJ_3dariE54A7eGIJxkhzeZPtTW70kvrbG2ZAQpg1XMvPhr80cO7t1yv_BhJL0wsrsyvpBls1GjPu-0eY77xfXJoc-B0zniqLGnG6IRr7N3y_QCSs463TPCnvnKwcn_T1zbXFvq0p80OesoaMr3o6rQlsthcboTe6RUlA34JG5yLhzWat9owRTILWfC88poYLOfEVF-_wk5GZLUIe-PQ5KfZf7fnxEskq5YNqkh6dfQRRwVTNYk7-P0L3g_E-c7pJ7KIG3faLaRfdGYw5BzluRAwubV93kfzemR94aLNKJ4OQSeYh-SLRFTswgSCSgeZ6W9GoVjy2hRHWF0XUP9Elgej5l-Ffcy5JPZ2xA-LBfOMPh4dN7OLrvRgg5wjjPmbyQHfoOdVhF_Hi41A2X4G_svoikTG3hbEoZ-Jrw8tUsz05YZkdKtsTH3X3v-gibeSO4Uv_1YJCTYIzkbXGGgX5XmmLD2brYwnxh3cemfKaaJAWnfx9Z7SpROr3ryaQ7dJwBEs4oI4IWklUBMCknn8ebiorEypqPcmacQMYIWyY79fvIZN0GyEyf137PWRKsqkQ5enTIDXl0gLlRFGdV_yNWIO8uPRSQyG9PnignyATaCq-E_uwkq0nIKK4vTE8KfhAMHsyLfWWgOASYuRkMFl5dzp-C2-du0eJq-81I5jZFU0vIcFhJtamrTQsUY1hJM7w3Aew5md4S1e1Ug5xRY6yCgNE0oHI0SamkHhwdmePooti4tkJj7rexamonlDkkeS4Bm4NmywvRGtYpDdYUuvBOq-gZA24F9apu4n_uPpeI2YHaAcioHmb4P7NkEvjBEVAJgGb9-uOhQHDKhiwyXXC2wi-m360ZvDQQn54jMoDrqEs-Eu6bCza8EE8GyZlbI-CM-gZJTiHl1TvyGEG9J2dPChIPs4dzMDK7kvjKHhsrhpRQAA71q_VJyNLRmjcFZnt_lfVgC8VKWe8cevQ-jFTGLkKKsqV1TVnbtvxp-_hG9BFvLSDljZHD9lrGn7vGmXtxnT0NXTOXr7c9uiSX6lSTVeamWau7O9lOZ2PgISZ7N9jS9BHYlx4wHYTdftnytFVQAVph2UhC7NPVBCz9p04BVq0FxDCtGv2l2ic81eVSdxRQ-97uPzZHTxDxTcHC1Dmk-vrROUIOGfciefFovWnURSD9luH6g-awuoGPRGm5FeLncXoswQpM09kNpJymjGfZfDuCdiAGkGG9c3mdY-cJ7S_03locfYd_ZqzuZGWzE3M4TQftXObfwOImBS6nJQQUX2ME9mVKesnkoyNunErN6p0fUrtGElFq-qzQ7lnsnXjtuR4glFe67rSAuvftjde0bPjKhHdd3qiUfDrHqhd-CWshEHISaMGqD2AKVTBJDpoJExvtLB_4XzZDXi07_JnC_6_V2QJ6NmJ9vfg27yKeCMm57srCiUtZk_CIbj0ugIvS4oJgje8vGSlC4L96Ma1jPILgRfNS_wL6JweFTbd2aBuFyX2MS2iG8T7ZXH-XBQW-Sk3g-udctfuqi96O_TewfzTQ6u7_ee0buvkQQz4boMYETAZL3f7n8oQsW3c8lsa5fAtbVB33bVapEUkR5QSAkRc0VIFrBV5MNTWIlhyJOGyWskDw6mP8h2TJdjc79T84Hw_03y1BwW2eXElYXjauL02tvw1xON3-84yIaRokVyP-lLdWZrZM5wllB_nU95d_QMHkrOTmfxhrzfOIgqTgmzi79TbI6cUXPT5E4UKdSE_AICpej4_VnohyhIIhOkkAAiFfUQQ17KiVIDuyYUmQ4C3K_4Ww93XqW0_OpuEohMGPXbagVYy7LzQW-F3FZoZtBqZzPLwKdV8xwJQ4UpxLaVpQOMb4AyoSb-XNP4TRuJuoDOdpOm6_bFIk2Oj7XAke_2yDUPUiPsM8XNyNuR1mpyY7tQxk49zHrzXVgluZyJEtEJ3KYGT72o0xN4EzY9zC5gnEPzj9-QJZMDr7yvwjo2_Qu59Z_Ip6rkK7AaqdqVbJFiDv134VBSS8ng-d4-6PDVvw1esgcUz5YBzPLU6f8JsUB92_EZzw0T0XC0cW7cDgFnzRU2kiFJc0SsGU_CaWm6Lj9_Qf4QJ3mhzGE7AwqNvS4sDriT5mNbdJzHcj-gAsUqHmadSgmAP3qUcC5aTh97nn0MDqOpJSXXrv0S_5Qdz2z0oVUMxtcdLOl55Cjl1znme4m5xEUnoz-CvbWSHQSrNJRgl6od6FRORd9KhN_x2y5HyS_qADs63_bxIbjiRjw5qJzLu-xBXVH_CcSY0qxek1PblE5KzicyNNPTO9PIrRLHCnVdEFQ0lTRetPtdgPWAjhTKoMleRwDVivHk7GKdDggILTq1U1_7bm6e0EKAB8H-heLaX3K6yOY7F_u4m3Fub4GsnbbMeDtqdXQ7PB_bUljVyL0LaDMUv4wW9GKKUKFjIoqXAyn1youtr7_GJ0dRi7Ps4aT6Isfnyp7oqJNGfR9EOIyGYj64c7OWlq7FKK635wQkH7Nj2bNnA8TFUk8IohS9AnoT0qBQ6Xj2vkTogCynC3UFhpJl_snfkln1PnHp7wgG-qwl_oAB4h2ZiEnGdySEXpRCB_HC1fxMTrs1iSy9MYX-z8JIMBFD_35NB3wEFI-SMsdF3G3OxofAPJrKRakK4Qhn3-S3eicDeuLLTIsjRZVcU68TrsGq8WTmxlhRwEThfrVwepyz3KIz4Q11vbMC4zq8Bbet8QSvP-TsaxrhI-HDCJHg4KRW14_DmVQ8H4_GWmamuzThmtTlSeXqIjJTEzexeiOxLmJ6m0AomLE96lO8AAAAAAAAAAAAAAAAAAAAAAAAAAAAABQgSFRoh"
  },
  "spec_version": "0.1",
  "target": {
    "name": "run",
    "type": "none"
  }
}
