{
  "actor": {
    "id": "H342ugmg0Ea-GvTpUDeqxqFKsgeirlcywX047EFubuU",
    "type": "agent"
  },
  "agent_id": "H342ugmg0Ea-GvTpUDeqxqFKsgeirlcywX047EFubuU",
  "data_labels": [],
  "hash": "3796a22df4bd88762055cb829f5b237772e357c1950a75da3c409348b4fb6da1",
  "hash_alg": "sha-256",
  "kind": "run_end",
  "occurred_at": "2026-09-16T12:00:09.000Z",
  "outcome": "success",
  "prev_hash": "8412339398f0628a037fe254a3ec28152a1fe448a4e0a3d4fd85da82e8cb6a6c",
  "principal_id": "qJtRVbgIsIjNNo6VuDr6nQ50Wj3rwEAAuR2e385pby8",
  "record_id": "0192b3c4-5d6e-7f80-9a1b-000000000009",
  "run_id": "0192b3c4-5d6e-7f80-9a1b-0000000000a0",
  "seq": 8,
  "signatures": {
    "ed25519": "TCbo7Zw0vibJ8XEGCya0UukgVGmSEx6ACUWvkiDBod_DMIA_Oi9IEH9OYwz4tKu7cUr3A1-qDhNKYi9xieZzAQ",
    "ml-dsa-65": "PVACI72e9PPpm23k1ys4G7vkaj2UYqhIS5PJO5kONdlA_xLNkH51STC54nRvKoRowz9RdxhOozNVn_LwqOxhZYhQ9jY9qHsPUvuGA18FCFN58Poim1pQn6GN4m4wfM7KmsLAPtFobfp7eUHVvLDBoG51UWhv4GLuv1nyKRKawOE1vA27ANMQrLYwcU5bDtguC7vaRSI8SYn1mH9KV9ZtGg0iB-vmJSAjWeU7_K5eDu2J_pxTL3IPfmVpKtzmcdJK6u9XHobZyFRc2ZfnlH6M1xsfEVGr-jUbK4oC_Az7mS59F6ZoeyHx0KKo8AuY6iR27-7MZ5yd-lUWulDdR6KtaiYT8bHg60JqZrpuwMHBmpIwWT9PZ9VkUxrKtMJZjjVslCasDpljXFj4oK2ptGDj9Cv9iD-mxPYT3Nsq2fDpCqAhrg1FDx4WclpYnjsN10U3EZzjfqeVb5GMR9WI01oM1e7h-B4qJqyhuNzlCuQGIqnFWwWLFHc0D1ejr2o3zsshyXPfK08484562N3ATbDCc23Aqk7jAtxN2kDNGlXkky0SNadWGrxHQDlcNXyZqGHkBDr3pGvmrbfNRo3Oyp55WgLo9-EMbjTnvjrbIKQ3YyjgXZCv6KdDh2BiuJrPwLOZfNc6VmExmdgo2KUhKksDrc5gxxtSICLOynW38oF0x-F5mlA_yRrQIpMKby-t0D04AoFWhVL-ew6Lh7DlWQa1LtbzwRdI6djOhy2ilzERIu2Bi3M93BhbDtHHvBhDft5lZvVJ8veCjrHVlrwKnUdDVBS8fQ0-ET7q22h8nfFoh7l_nAElZr58qEr1-Um3x8sZeVEJXmnDK408md0u9-DMcQHXOBnJPm9z0xuBXSMH8eBv5ns5dFW6ZVPv8XJSp_7OxNqVhustrBX6mb0aXgzdy4r3gqpqQgHyzb_t2jNgP5abFLUDqDUtWZ05ypIy_NJ_8HVTU56b7BIhIqtY4SYeF3yziRL5NweQ_3xaBMZHKFDp27oSsEv8_8K4JEjUGnUnKwTMuFK-bNibgaRZ0EdodT6Z9SvHWM0QHaY0t0QJwXznhuR1v5GvDy0sB4Kvm7cPGdVtilms0E9ELvu_NTk3gNnYauC_H9h9tDZr1iLOreU_sZo9aibNrJbknqRTQs1ljvGaywG4NGwRB6htAxuD734EDFQJjDVlcLSIdiK48SI1GJWKlMFN43QT-krM1ltuQe06qrc7LUbBr7YYvVoSh-MNWcxgrOdna4CgMMohoQTdJRv8u6IbTbrYHw9VhogfQfHCEp_jXkLzUhek-IVzAUvPJ99dXx3erlu2B60-_Xi23vwjGSJYLKsdhV_MJYfGTAn4_lsXwuNXoZ7QfJW_prWdkWiEWW3e-ktFw8UXbocgnM5TTfxl5MJ05xavJ41LGVKzbeBe9ijcbPnzoSYVRhERBRC4mdDVl4eJ4yfYLHDOyxY2u8BfxPnBY-ZV0mH7VJGFukP-oQFhZs6xnm4JNn3U_mbUlVceQ6PpKfzwIB07wSceERomhiwLYio8RGJMjk_dQQ3QGCPzT0SNOFNHaXqvjGj9lcKU2tx921M5xaZSqVftuqPQsHwXrYOfoEqcLo0fr4BpnDTmpS04efMA-9sLY-oRrZ1MncXERaJr0R_bGzLw8eclz2AGwO-X88sm3n9bJ58IX5JKm3nJz8-Umxdc9nGpRN_HO7jxEL4lfsPS9pKVzaCvvl4VsqifXZxWq6GVmhamfPBwVbf7yrBnTykCMCrBQpTz20M3pCLt5u-z74MA-jJdxvAd4fXMu1oOLYNgkYEgedz0Vuuv6Uz3ITI_gSop5UwidxPHbiLYCtptFN4ekqIKb9EMh7dYuE0-k96C7ZQEI3Tsmy7TksHYRksJozJh5z0mkH2XO5RBBwRTswGe-DlO3hsZcfVSb-mlenVkhiaU-H_eb5jsfImq1SRfxqtw4hmJTcSsyYiwCvAxnUPBxsrmRQ1a7xnOV4Ecq6MZyD_VcRRH1Jcxjym7dzHYX7q0-n_nq1HJpCdnL1Hlf138o_8Tc-xoF66aT8Ea1g09GlR9kLiprAp4MJ9pvfAoC7nR6dxDOkFxLazjy9VNV_7aOiWT9Oj9kWT2kivh1GVD2gnHWqGteXBwdwJr9yzBEiF6t78Ten6ALw7srvNFxrTB_ytPlLNm7IoOYDDI_3gtb-SsTvAOMI3TkpqCpAwDHg6XkPMFoQDMwNBX0MDSA9aTZIrjat90QpYRvI-EScywAO2mjfmofCIfIdWe8nqmh0xy0kL-SLSx20OrIA43KH_ZyJmo90UwwL80V4aucsMZ7nIIlD7Nng6RkQPn1XAyMpv4j2U19YYT1NSM-Ema5a9oJGTihxFhFIrtniIbP0JTRSnHRhCYEKxXLI2EcjWB1bSRdJuTeHCG3paZPFW50lBeyJbR5sP2lnHRHYDiXtQgNiRrlFiYrJoC3vHB-KbIS7bRpWMWcp4gl0FM9Yb5gjK0ZPO40P9hMaX8nPejRYu2y5uha1XX3geez9bylT3FbtwKpCuIAmpih9YRBcLItylnqsIjN17JjSxIO3-DfTNjgwrElEwzaLwu18KkQw0rTNC9TZbkWatWb7U8UwqmIAguVZh-_AxQ4SrUUkPA2cOWsvH7Fd0GcSWQs30MemmFPc74grvRnWQORaNU5Z00kw_jTkCEe09EkdETKfpJPLO1KcVHFhK-UtjgLdzUGvnKyPf2N_zKSYAy2oDuqqX53_WhiMIsHenQSWa5A0c8-oeACe5pAgl_KPgrvRq4X_DY_b9Qn7_q1oijJbKY5A05cPiZKZ5EJ5T8L5hLqwUDei0jZ3sJOLiXrr105-3aBRhUZHzORKzcc9TEN8Oacs7JiTj8W7enIyVHY2BikqCOx7ZqEenyGk554FiyEjkX_oWsraH7lVqJUo6WOIbbwTQdgsT0mOAS1BHf3ZnGNuBxjyGsA8eivFaQ38ofi5Ce0jY9otFjLEObGramT9YxFTtmhBU_qKYsj_VL6kNR49xKRYImrfYg57K5-rio9UCUsMhgnX0HvNIGo-LHVJc5POo7_wFxE_XVs7D8Tvkab1GQV7Fgrw6R01F30kaPqcc7MB9LFvYCpHlm5cK9y6TO8FDwTPYow9g7QEptO4sEnsW-H_azpumHa-LcirEJlOfHxtE_6EPDN8patmgyofiLcj4rUELEeDbOXlIZ43LtPY-ieApalheJueXa3YU1r4VdqM_zQOs2kUxTsUjyiFRryNfL8FNKEmfg2JozKcRfHRYRugFrMrToN5JnetEocAaW4rQvIEulHVPMcl8JxuDI9UO8x84716kcI0rnG5UaqEnt3HwPgzczyPP-nTOSkEnfMeGdg59tr24tTx8IN7Y12tNZzrOLpjCgY2b7MAfFPApziU_4ncMGxrZdLH5hi7UkLYYUgE73b3zX2rmHCIhELWVQpAhmpMocZ7dUiRliDxlZC7XHx1VX9MFti8F6x0qgM2zjuWO2M35DLgQjJZQUOwKn82UGKU8rccY89pKFK4WLaFvxVTiOFno8wTMVH95r1cnuzo66OgqumxFIxrNHZ0T_WMs42AOAZU25xMJBR4_csu6zqmdPLdozFfvxghxyHhEjz9AgBXw4hkbvgk4OEx_oMx2aktPHDsG1ONhHRQAps-i_8imBdSglxWL96qAcyLFOPO7HJv5wgjTd4spQs4hpdAFod6cq4R2_LDbcnUd4mFawAsm-k6xnmL6ZuckCOprclPW8WMA3yxy7MebXin0ArZezDepftu6vBh7yo_FIRI4ZZB7RPnT8LRL-e1WlwHBgEKZsGKOzmlQfgSKbuUNxuDTF8jhY3DKYKluZmuoUtlSdKMpVVZKxP3SH9xJ5YPnT2Oa_l1nl6MRU3ThAeLJtjLgq3eAC4zaTjWO8-hgU3HTW5UT5OVUGcwdoj1i4M8htYNFL7AndLNL6zj1X83B33U0pz6X8_HBMuBgKMHEovvLSU1t0Pnb0VCS9fu5_cJifoQYjsYDWIhdfax3apV9n8I3giFHtSMdmL2-TuQHgQSl9Qs9s9qtBKA22B8or2fNb1A664rcMVxdAZqY0U7ISM5vRrAa018JjrVNrU0F9UUEokOVjCknqzga56J3lNwYIbMFKbgKf13GydawMDNrOSUuox5tkPhyXsNlHGYS74JtSiQJaamtzbifSD3Dg4sG7j1pNlOt4SxyaSFZ3krwACTQh-WMrAuYYvR3_ufKjgCluFlK4DWRZr68gc9n1urirwnmi6sb-DnHgkDbt2mczKJDQZBaxIAAFwNQlXeoLZFJ70u1GDf4LKHN849019-olPCq7z1t1M1dnjcTylvkeJFW20QpSc4Cvt-QHGiWDnqmys8_eaqnV-gINYZxfbn3AAAAAAAAAAAAAAAAAAAAAAAAAAAAABQwWGh4i"
  },
  "spec_version": "0.1",
  "target": {
    "name": "run",
    "type": "none"
  }
}
